key,speech_date,speech_time,company_id,company_name,subject,matched_keywords,enterDate,marketKind,serialNumber,detail_json,fetched_at_tw
1150115|sii|2485|2,115/01/15,15:20:48,2485,兆赫,係因本公司有價證券於集中交易市場達公布注意交易資訊標準，故公布相關財務業務等重大訊息，以利投資人區別瞭解。,有價證券,1150115,sii,2,"{""code"": 200, ""message"": ""查詢成功"", ""result"": {""marketName"": ""上市公司"", ""companyId"": ""2485"", ""data"": [[2, ""115/01/15"", ""15:20:48"", ""何文順"", ""財務長"", ""(02)2225-1929#568"", ""係因本公司有價證券於集中交易市場達公布注意交易資訊\r\n標準，故公布相關財務業務等重大訊息，以利投資人區別瞭解。"", ""51"", ""115/01/15"", ""1.事實發生日:115/01/15\n2.發生緣由:依據臺灣證券交易所股份有限公司指示辦理。\n3.財務業務資訊:\n期間            (月)                    (季)            (最近四季累計)\n========================================================================\n        最近一月    與去年同期   最近一季    與去年同期   (113年第4季至\n                                                           114年第3季)\n科目   (114年12月)    增減％   (114年第3季)    增減％\n       (合併自結數)            (合併核閱數)             (合併查核/核閱數)\n========================================================================\n營業收入(百萬) 328     129%        601         119%        2,054\n稅前淨利(百萬)  39     144%        (12)         96%        (684)\n歸屬母公司\n業主淨利(百萬)  39     152%        (12)         96%        (657)\n每股盈餘(元)  0.12     152%       (0.04)        95%        (2.07)\n因客戶端產品驗證通過，正式進入量產與備貨階段，帶動出貨量顯著提升\n，致使本月營收較去年同期大幅成長。\n4.有無「臺灣證券交易所股份有限公司對有價證券上市公司重大訊息之查證暨公開處理\n  程序」第4條所列重大訊息之情事（如「有」，請說明）:無。\n5.有無「臺灣證券交易所股份有限公司對有價證券上市公司重大訊息之查證暨公開處理\n  程序」第11條所列重大訊息說明記者會之情事:無。\n6.完整財務資訊請至公開資訊觀測站查閱，路徑如下：\n(1)近期營業收入及損益資訊：基本資料>精華版\n(2)歷史每月營業收入：營運概況>每月營收>採用IFRSs後之月營業收入資訊\n(3)歷史損益(會計師查核/核閱數)：財務報表>採IFRSs後>合併/個別報表>綜合損益表\n(4)歷史損益(自願性公告自結數)：營運概況>自結損益公告:無。\n7.其他應敘明事項:無。""]], ""footer"": [""以上資料均由各公司依發言當時所屬市場別之規定申報後，由本系統對外公佈，資料如有虛偽不實，均由該公司負責。""], ""header"": {""note"": [], ""subTitle"": [], ""mainTitle"": [""公司當日重大訊息之詳細內容""]}, ""titles"": [{""main"": ""序號"", ""sub"": []}, {""main"": ""發言日期"", ""sub"": []}, {""main"": ""發言時間"", ""sub"": []}, {""main"": ""發言人"", ""sub"": []}, {""main"": ""發言人職稱"", ""sub"": []}, {""main"": ""發言人電話"", ""sub"": []}, {""main"": ""主旨"", ""sub"": []}, {""main"": ""符合條款"", ""sub"": []}, {""main"": ""事實發生日"", ""sub"": []}, {""main"": ""說明"", ""sub"": []}], ""companyAbbreviation"": ""兆赫""}, ""datetime"": ""115/01/15 15:24:09""}",2026-01-15 15:24:02
1150114|otc|8038|2,115/01/14,17:33:27,8038,長園科,本公司有價證券近期多次達公佈注意交易資訊標準，故公告相關訊息，以利投資人區別暸解,有價證券,1150114,otc,2,"{""code"": 200, ""message"": ""查詢成功"", ""result"": {""marketName"": ""上櫃公司"", ""companyId"": ""8038"", ""data"": [[2, ""115/01/14"", ""17:33:27"", ""張惇育"", ""總經理"", ""04-25658768"", ""本公司有價證券近期多次達公佈注意交易資訊標準，故公告相關\r\n訊息，以利投資人區別暸解"", ""53"", ""115/01/14"", ""1.事實發生日:115/01/14\n2.發生緣由:依財團法人中華民國證券櫃檯買賣中心通知辦理。\n3.財務業務資訊:\n(1)單月\n                        最近一月單月      去年同月     與去年同期增減%\n                          (114/12)       (113/12)\n---------------------------------------------------------------------\n營業收入(百萬元)              107             34           215%\n稅前淨利(百萬元)               15            (17)          188%(由虧轉盈)\n歸屬母公司業主淨利(百萬元)      13            (16)          181%(由虧轉盈)\n每股盈餘(元)                 0.21          (0.25)          184%(由虧轉盈)\n======================================================================\n(2)單季\n                        最近一季單季      去年同期     與去年同期增減%\n                          (114第3季)     (113第3季)\n----------------------------------------------------------------------\n營業收入(百萬元)              210             51     　    312%\n稅前淨利(百萬元)               44            (21)     　   310%(由虧轉盈)\n歸屬母公司業主淨利(百萬元)      43            (18)      　  339%(由虧轉盈)\n每股盈餘(元)                 0.69          (0.28)     　   346%(由虧轉盈)\n======================================================================\n(3)最近四季累計\n                        (113年第4季至114年第3季)\n----------------------------------------------------------------------\n營業收入(百萬元)              501\n稅前淨利(百萬元)               25\n歸屬母公司業主淨利(百萬元)      33\n每股盈餘(元)                 0.53\n======================================================================\n公司每股面額:10元。\n4.有無「財團法人中華民國證券櫃檯買賣中心對有價證券上櫃公司\n重大訊息之查證暨公開處理程序 」第4條所列重大訊息之情事（如\n「有」，請說明）:無。\n5.有無「財團法人中華民國證券櫃檯買賣中心對有價證券上櫃公司\n重大訊息之查證暨公開處理程序」第11條所列重大訊息說明記者會\n之情事:無。\n6.其他應敘明事項:\n(註1)：以上114年12月及去年同期比較數之財務資料係本公司採IFRS會計準則編製之\n合併數，未經會計師查核(閱)，僅供投資人參考。\n(註2)：最近一季114年第三季係指單季數字，非為最近財務報告中之累計數字，\n且係本公司採IFRS下編製之合併數，業經會計師查核(閱)，僅供投資人參考。\n(註3)：最近四季累計係本公司113年第四季至114年第三季採IFRS編製之合併數，\n業經會計師查核(閱)，僅供投資人參考。""]], ""footer"": [""以上資料均由各公司依發言當時所屬市場別之規定申報後，由本系統對外公佈，資料如有虛偽不實，均由該公司負責。""], ""header"": {""note"": [], ""subTitle"": [], ""mainTitle"": [""公司當日重大訊息之詳細內容""]}, ""titles"": [{""main"": ""序號"", ""sub"": []}, {""main"": ""發言日期"", ""sub"": []}, {""main"": ""發言時間"", ""sub"": []}, {""main"": ""發言人"", ""sub"": []}, {""main"": ""發言人職稱"", ""sub"": []}, {""main"": ""發言人電話"", ""sub"": []}, {""main"": ""主旨"", ""sub"": []}, {""main"": ""符合條款"", ""sub"": []}, {""main"": ""事實發生日"", ""sub"": []}, {""main"": ""說明"", ""sub"": []}], ""companyAbbreviation"": ""長園科""}, ""datetime"": ""115/01/15 15:24:09""}",2026-01-15 15:24:02
1150114|otc|6179|2,115/01/14,17:36:10,6179,亞通,公告本公司114年現金增資認股基準日相關事宜,現金增資,1150114,otc,2,"{""code"": 200, ""message"": ""查詢成功"", ""result"": {""marketName"": ""上櫃公司"", ""companyId"": ""6179"", ""data"": [[2, ""115/01/14"", ""17:36:10"", ""楊智鈞"", ""副總經理"", ""02-86961585"", ""公告本公司114年現金增資認股基準日相關事宜"", ""11"", ""115/01/14"", ""1.董事會決議或公司決定增資基準日期:115/01/14\n2.是否採總括申報發行新股(是，請併敘明預定發行期間/否):否\n3.主管機關申報生效日期:115/01/08\n4.董事會決議(追補)發行日期:114/11/24\n5.發行總金額及股數:新臺幣500,000仟元、普通股50,000仟股\n6.採總括申報發行新股案件，本次發行金額及股數:不適用\n7.採總括申報發行新股案件，本次發行後，剩餘之金額及股數餘額:不適用\n8.每股面額:新臺幣10元\n9.發行價格:暫訂每股發行價格為新臺幣24元，訂價方式謹依「中華民國證券商業同業\n  公會承銷商會員輔導發行公司募集與發行有債證券自律規則」規定，並授權董事長\n  參酌發行時市場狀況及其他相關法令規定，與主辦承銷商共同商議決定。\n10.員工認股股數:依公司法第267條規定，保留15%計7,500仟股由本公司員工認購。\n11.原股東認購比率:提撥本次發行股數之75%，計37,500仟股由原股東按認股基準日之\n  股東名簿所載持股比例認購。\n12.公開銷售方式及股數:提撥發行新股總額10%，計5,000仟股辦理公開申購。\n13.畸零股及逾期未認購股份之處理方式:認購不足一股之畸零股，自停止過戶日起五日內\n  由股東自行拼湊。原股東及員工放棄認購之股份或拼湊不足一股之畸零股部分，擬請\n  董事會授權董事長洽特定人按發行價格認購之。\n14.本次發行新股之權利義務:與原已發行普通股股份相同\n15.本次增資資金用途:充實營運資金\n16.現金增資認股基準日:115/02/27\n17.最後過戶日:115/02/22\n18.停止過戶起始日期:115/02/23\n19.停止過戶截止日期:115/02/27\n20.股款繳納期間:\n  原股東及員工繳款期間：115/03/04~115/03/10\n  特定人繳款期間：115/03/11~115/03/12\n21.與代收及專戶存儲價款行庫訂約日期:待正式簽約後另行公告之。\n22.委託代收存款機構:待正式簽約後另行公告之。\n23.委託存儲款項機構:待正式簽約後另行公告之。\n24.其他應敘明事項:\n  (1)本次現金增資發行普通股50,000仟股乙案，業經金融監督管理委員會\n     115年1月8日金管證發字第1140368538號函申報生效在案。\n  (2)本次現金增資之重要內容，包括實際發行價格、發行股數、發行條件及方式、\n     募集金額、計畫項目、資金運用進度、預計可能產生效益暨其他一切有關本次\n     現金增資發行計畫之事項，未來如因主管機關指示修正或基於營運評估，或因\n     法令規定或因客觀環境需要而須變更時，授權董事長依市場狀況全權處理之。\n  (3)除權交易日：115/02/10（最後含權買進日115/02/09）\n  (4)最後過戶日：115/02/22（適逢假日現場過戶提前至115/02/11）\n  (5)債券最後申請轉換日期：115/01/20\n  (6)債券停止轉換起始日期：115/01/22\n  (7)債券停止轉換截止日期：115/02/27""]], ""footer"": [""以上資料均由各公司依發言當時所屬市場別之規定申報後，由本系統對外公佈，資料如有虛偽不實，均由該公司負責。""], ""header"": {""note"": [], ""subTitle"": [], ""mainTitle"": [""公司當日重大訊息之詳細內容""]}, ""titles"": [{""main"": ""序號"", ""sub"": []}, {""main"": ""發言日期"", ""sub"": []}, {""main"": ""發言時間"", ""sub"": []}, {""main"": ""發言人"", ""sub"": []}, {""main"": ""發言人職稱"", ""sub"": []}, {""main"": ""發言人電話"", ""sub"": []}, {""main"": ""主旨"", ""sub"": []}, {""main"": ""符合條款"", ""sub"": []}, {""main"": ""事實發生日"", ""sub"": []}, {""main"": ""說明"", ""sub"": []}], ""companyAbbreviation"": ""亞通""}, ""datetime"": ""115/01/15 15:24:10""}",2026-01-15 15:24:02
1150114|otc|6640|2,115/01/14,17:42:43,6640,均華,公告本公司114年第4季自結合併損益,自結合併,1150114,otc,2,"{""code"": 200, ""message"": ""查詢成功"", ""result"": {""marketName"": ""上櫃公司"", ""companyId"": ""6640"", ""data"": [[2, ""115/01/14"", ""17:42:43"", ""石敦智"", ""總經理"", ""22682216"", ""公告本公司114年第4季自結合併損益"", ""53"", ""115/01/14"", ""1.事實發生日:115/01/14\n2.公司名稱:均華精密工業股份有限公司\n3.與公司關係(請輸入本公司或子公司):本公司\n4.相互持股比例:不適用\n5.發生緣由:\n本公司114年第4季合併稅前淨利為112,500仟元；歸屬於母公司業主之稅後\n淨利為94,687仟元；每股盈餘為3.35元。\n114年累計至12月份為止，合併稅前淨利為417,281仟元；歸屬於母公司業主之稅後\n淨利為357,904仟元；每股盈餘為12.75元。\n6.因應措施:無\n7.其他應敘明事項(若事件發生或決議之主體係屬公開發行以上公司，\n本則重大訊息同時符合證券交易法施行細則第7條第9款所定\n對股東權益或證券價格有重大影響之事項):上述自結數尚未經會計師查核或核閱　\n，實際獲利數字依本公司公告之每季經會計師簽證(核閱)之財務報告為準。""]], ""footer"": [""以上資料均由各公司依發言當時所屬市場別之規定申報後，由本系統對外公佈，資料如有虛偽不實，均由該公司負責。""], ""header"": {""note"": [], ""subTitle"": [], ""mainTitle"": [""公司當日重大訊息之詳細內容""]}, ""titles"": [{""main"": ""序號"", ""sub"": []}, {""main"": ""發言日期"", ""sub"": []}, {""main"": ""發言時間"", ""sub"": []}, {""main"": ""發言人"", ""sub"": []}, {""main"": ""發言人職稱"", ""sub"": []}, {""main"": ""發言人電話"", ""sub"": []}, {""main"": ""主旨"", ""sub"": []}, {""main"": ""符合條款"", ""sub"": []}, {""main"": ""事實發生日"", ""sub"": []}, {""main"": ""說明"", ""sub"": []}], ""companyAbbreviation"": ""均華""}, ""datetime"": ""115/01/15 15:24:10""}",2026-01-15 15:24:02
1150114|otc|6163|1,115/01/14,18:40:34,6163,華電網,本公司可轉換公司債華電網五(代號：61635)近期達公布注意交易資訊標準，故公告相關訊息，以利投資人區別瞭解。,公司債,1150114,otc,1,"{""code"": 200, ""message"": ""查詢成功"", ""result"": {""marketName"": ""上櫃公司"", ""companyId"": ""6163"", ""data"": [[1, ""115/01/14"", ""18:40:34"", ""王榮德"", ""營運長"", ""(02)26967155"", ""本公司可轉換公司債華電網五(代號：61635)近期達公布\r\n注意交易資訊標準，故公告相關訊息，以利投資人區別瞭解。"", ""53"", ""115/01/14"", ""1.事實發生日:115/01/14\n2.發生緣由:依櫃買中心通知辦理。\n3.財務業務資訊:華電網五(61635)可轉債相關資訊\n到期日期：117/10/16\n實際發行總額：300,000,000元\n本月發行餘額：300,000,000元(截至115/01/14)\n最新轉(交)換價格：25.0200\n轉換標的收市價格(6163)：72.7 (115/01/14)\n轉換債收市價格(61635)：285 (115/01/14)\n4.有無「財團法人中華民國證券櫃檯買賣中心對有價證券上櫃公司\n重大訊息之查證暨公開處理程序 」第4條所列重大訊息之情事（如\n「有」，請說明）:無\n5.有無「財團法人中華民國證券櫃檯買賣中心對有價證券上櫃公司\n重大訊息之查證暨公開處理程序」第11條所列重大訊息說明記者會\n之情事:無\n6.其他應敘明事項:無""]], ""footer"": [""以上資料均由各公司依發言當時所屬市場別之規定申報後，由本系統對外公佈，資料如有虛偽不實，均由該公司負責。""], ""header"": {""note"": [], ""subTitle"": [], ""mainTitle"": [""公司當日重大訊息之詳細內容""]}, ""titles"": [{""main"": ""序號"", ""sub"": []}, {""main"": ""發言日期"", ""sub"": []}, {""main"": ""發言時間"", ""sub"": []}, {""main"": ""發言人"", ""sub"": []}, {""main"": ""發言人職稱"", ""sub"": []}, {""main"": ""發言人電話"", ""sub"": []}, {""main"": ""主旨"", ""sub"": []}, {""main"": ""符合條款"", ""sub"": []}, {""main"": ""事實發生日"", ""sub"": []}, {""main"": ""說明"", ""sub"": []}], ""companyAbbreviation"": ""華電網""}, ""datetime"": ""115/01/15 15:24:11""}",2026-01-15 15:24:02
1150114|otc|6904|1,115/01/14,19:51:58,6904,伯鑫,公告本公司董事會決議現金增資持股100%之子公司加璽企業股份有限公司,現金增資,1150114,otc,1,"{""code"": 200, ""message"": ""查詢成功"", ""result"": {""marketName"": ""上櫃公司"", ""companyId"": ""6904"", ""data"": [[1, ""115/01/14"", ""19:51:58"", ""吳昌旻"", ""副總經理"", ""(04)2562-7786"", ""公告本公司董事會決議現金增資持股100%之\r\n子公司加璽企業股份有限公司"", ""20"", ""115/01/14"", ""1.標的物之名稱及性質（屬特別股者，並應標明特別股約定發行條件，如股息率等）:\r\n加璽企業股份有限公司之普通股\r\n2.事實發生日:115/1/14~115/1/14\r\n3.董事會通過日期: 民國115年1月14日\r\n4.其他核決日期: 不適用\r\n5.交易數量、每單位價格及交易總金額:\r\n交易數量：以2,000,000股為上限\n每單位價格：新台幣100元\n交易總金額：以新台幣200,000,000元為上限\r\n6.交易相對人及其與公司之關係（交易相對人如屬自然人，且非公司之\r\n關係人者，得免揭露其姓名）:\r\n交易相對人：加璽企業股份有限公司\n與公司之關係：本公司100%持股之子公司\r\n7.交易相對人為關係人者，並應公告選定關係人為交易對象之原因及前次移\r\n轉之所有人、前次移轉之所有人與公司及交易相對人間相互之關係、前次\r\n移轉日期及移轉金額:\r\n現金增資故不適用。\r\n8.交易標的最近五年內所有權人曾為公司之關係人者，尚應公告關係人之取\r\n得及處分日期、價格及交易當時與公司之關係:\r\n現金增資故不適用。\r\n9.本次係處分債權之相關事項（含處分之債權附隨擔保品種類、處分債權\r\n如有屬對關係人債權者尚需公告關係人名稱及本次處分該關係人之債權\r\n帳面金額:\r\n不適用。\r\n10.處分利益（或損失）（取得有價證券者不適用）（原遞延者應列表說明\r\n認列情形）:\r\n不適用。\r\n11.交付或付款條件（含付款期間及金額）、契約限制條款及其他重要約定\r\n事項:\r\n依加璽企業股份有限公司現金增資規劃時程。\r\n12.本次交易之決定方式、價格決定之參考依據及決策單位:\r\n決策單位：董事會\n交易之決定方式及價格決定之參考依據：由本公司董事會授權董事長\n視加璽公司實際增資時程與認購股份狀況及發行條件參與增資，並依\n法令及本公司相關內部作業程序規定全權處理。\r\n13.取得或處分有價證券標的公司每股淨值:\r\n65.22元\r\n14.迄目前為止，累積持有本交易證券（含本次交易）之數量、金額、持股\r\n比例及權利受限情形（如質押情形）:\r\n累積持有本交易證券數量：3,000,000股 \n金額：新台幣 241,760,000元 \n持股比例：100%\n權利受限情形：無\r\n15.迄目前為止，依「公開發行公司取得或處分資產處理準則」第三條所列\r\n之有價證券投資（含本次交易）占公司最近期財務報表中總資產及歸屬\r\n於母公司業主之權益之比例暨最近期財務報表中營運資金數額（註二）:\r\n占公司最近期財報總資產比例：14.26% \n占公司最近期歸屬於母公司業主之權益比例：24.55% \n營運資金：新台幣335,019仟元\r\n16.經紀人及經紀費用:\r\n無。\r\n17.取得或處分之具體目的或用途:\r\n充實營運資金，支付收購價款。\r\n18.本次交易表示異議董事之意見:\r\n無。\r\n19.本次交易為關係人交易:是\r\n20.監察人承認或審計委員會同意日期:\r\n民國115年1月14日\r\n21.本次交易會計師出具非合理性意見:不適用\r\n22.會計師事務所名稱:\r\n不適用。\r\n23.會計師姓名:\r\n不適用。\r\n24.會計師開業證書字號:\r\n不適用。\r\n25.是否涉及營運模式變更:否\r\n26.營運模式變更說明:\r\n無此情形。\r\n27.過去一年及預計未來一年內與交易相對人交易情形:\r\n不適用。\r\n28.資金來源:\r\n不適用。\r\n29.前已就同一件事件發布重大訊息日期: 不適用\r\n30.其他敘明事項:\r\n無。""]], ""footer"": [""以上資料均由各公司依發言當時所屬市場別之規定申報後，由本系統對外公佈，資料如有虛偽不實，均由該公司負責。""], ""header"": {""note"": [], ""subTitle"": [], ""mainTitle"": [""公司當日重大訊息之詳細內容""]}, ""titles"": [{""main"": ""序號"", ""sub"": []}, {""main"": ""發言日期"", ""sub"": []}, {""main"": ""發言時間"", ""sub"": []}, {""main"": ""發言人"", ""sub"": []}, {""main"": ""發言人職稱"", ""sub"": []}, {""main"": ""發言人電話"", ""sub"": []}, {""main"": ""主旨"", ""sub"": []}, {""main"": ""符合條款"", ""sub"": []}, {""main"": ""事實發生日"", ""sub"": []}, {""main"": ""說明"", ""sub"": []}], ""companyAbbreviation"": ""伯鑫""}, ""datetime"": ""115/01/15 15:24:11""}",2026-01-15 15:24:02
1150109|otc|6904|2,115/01/14,19:54:20,6904,伯鑫,代重要子公司加璽企業股份有限公司公告董事會決議現金增資案,現金增資,1150109,otc,2,"{""code"": 200, ""message"": ""查詢成功"", ""result"": {""marketName"": ""上櫃公司"", ""companyId"": ""6904"", ""data"": [[2, ""115/01/14"", ""19:54:20"", ""吳昌旻"", ""副總經理"", ""(04)2562-7786"", ""代重要子公司加璽企業股份有限公司 公告董事會決議現金增資案"", ""11"", ""115/01/14"", ""1.董事會決議日期:115/01/14\n2.增資資金來源:現金增資\n3.是否採總括申報發行新股(是，請併敘明預定發行期間/否):否\n4.全案發行總金額及股數(如屬盈餘或公積轉增資，發行股數則不含配發給員工部分):\n  (1)發行總金額：新台幣200,000,000元\n  (2)發行股數：2,000,000股\n5.採總括申報發行新股案件，本次發行金額及股數:不適用\n6.採總括申報發行新股案件，本次發行後，剩餘之金額及股數餘額:不適用\n7.每股面額:新台幣10元\n8.發行價格:每股新台幣100元\n9.員工認購股數或配發金額:本次現金增資依公司法第267條規定，保留發行股數之10%，\n  共計200,000股由加璽公司員工認購。\n10.公開銷售股數:不適用\n11.原股東認購或無償配發比例(請註明暫定每仟股認購或配發股數):原股東每仟股認購\n   900股，共計1,800,000股，佔本次發行總股90%。\n12.畸零股及逾期未認購股份之處理方式:認購不足一股之畸零股，得由股東自停止過戶日\n   起五日內，逕向本公司辦理拼湊，逾期未拼湊及原股東、員工放棄認購或認購不足\n   一股之畸零股，擬授權董事長洽特定人按發行價格認購。\n13.本次發行新股之權利義務:與原發行普通股權利義務相同。\n14.本次增資資金用途:充實營運資金及轉投資。\n15.其他應敘明事項:本次現金增資發行新股相關日期、實際發行股數及未盡事宜，如因\n   主管機關或因法令規定及客觀環境改變而需變更時，擬授權董事長全權處理之。""]], ""footer"": [""以上資料均由各公司依發言當時所屬市場別之規定申報後，由本系統對外公佈，資料如有虛偽不實，均由該公司負責。""], ""header"": {""note"": [], ""subTitle"": [], ""mainTitle"": [""公司當日重大訊息之詳細內容""]}, ""titles"": [{""main"": ""序號"", ""sub"": []}, {""main"": ""發言日期"", ""sub"": []}, {""main"": ""發言時間"", ""sub"": []}, {""main"": ""發言人"", ""sub"": []}, {""main"": ""發言人職稱"", ""sub"": []}, {""main"": ""發言人電話"", ""sub"": []}, {""main"": ""主旨"", ""sub"": []}, {""main"": ""符合條款"", ""sub"": []}, {""main"": ""事實發生日"", ""sub"": []}, {""main"": ""說明"", ""sub"": []}], ""companyAbbreviation"": ""伯鑫""}, ""datetime"": ""115/01/15 15:24:12""}",2026-01-15 15:24:02
