key,speech_date,speech_time,company_id,company_name,subject,matched_keywords,enterDate,marketKind,serialNumber,detail_json,fetched_at_tw
1150109|otc|5465|1,115/01/09,17:19:33,5465,富驊,公告本公司114年12月份自結合併營業收入。,自結合併,1150109,otc,1,"{""code"": 200, ""message"": ""查詢成功"", ""result"": {""marketName"": ""上櫃公司"", ""companyId"": ""5465"", ""data"": [[1, ""115/01/09"", ""17:19:33"", ""王駿東"", ""董事長"", ""(03)3269123"", ""公告本公司114年12月份自結合併營業收入。"", ""53"", ""115/01/09"", ""1.事實發生日:115/01/09\n2.公司名稱:富驊企業股份有限公司\n3.與公司關係(請輸入本公司或子公司):本公司\n4.相互持股比例:不適用。\n5.發生緣由:\n一、本公司114年12月份自結合併營業收入為新台幣338,143仟元\n    較去年同期減少35%。\n二、累計至12月份自結合併營業收入為新台幣5,454,597仟元\n   ，較去年同期增加22%。\n三、以上資訊係本公司初步自行結算結果，並未經會計師簽證或核閱。\n四、前述詳細資料業已輸入公開資訊觀測站資訊系統，網址\n     http://mops.twse.com.tw。\n6.因應措施:無。\n7.其他應敘明事項(若事件發生或決議之主體係屬公開發行以上公司，\n本則重大訊息同時符合證券交易法施行細則第7條第9款所定\n對股東權益或證券價格有重大影響之事項):無。""]], ""footer"": [""以上資料均由各公司依發言當時所屬市場別之規定申報後，由本系統對外公佈，資料如有虛偽不實，均由該公司負責。""], ""header"": {""note"": [], ""subTitle"": [], ""mainTitle"": [""公司當日重大訊息之詳細內容""]}, ""titles"": [{""sub"": [], ""main"": ""序號""}, {""sub"": [], ""main"": ""發言日期""}, {""sub"": [], ""main"": ""發言時間""}, {""sub"": [], ""main"": ""發言人""}, {""sub"": [], ""main"": ""發言人職稱""}, {""sub"": [], ""main"": ""發言人電話""}, {""sub"": [], ""main"": ""主旨""}, {""sub"": [], ""main"": ""符合條款""}, {""sub"": [], ""main"": ""事實發生日""}, {""sub"": [], ""main"": ""說明""}], ""companyAbbreviation"": ""富驊""}, ""datetime"": ""115/01/09 23:46:47""}",2026-01-09 23:46:27
1150109|otc|8234|2,115/01/09,18:00:48,8234,新漢,代重要子公司新漢智能系統股份有限公司公告-重新訂定現金增資認股基準日,現金增資,1150109,otc,2,"{""code"": 200, ""message"": ""查詢成功"", ""result"": {""marketName"": ""上櫃公司"", ""companyId"": ""8234"", ""data"": [[2, ""115/01/09"", ""18:00:48"", ""陳原彬"", ""財務長"", ""(02)8226-7786"", ""代重要子公司新漢智能系統股份有限公司公告-\r\n重新訂定現金增資認股基準日"", ""11"", ""115/01/09"", ""1.董事會決議或公司決定日期:115/01/09\n2.發行股數:15,000,000股\n3.每股面額:新台幣10元\n4.發行總金額:150,000,000元\n5.發行價格:新台幣10元\n6.員工認股股數:1,500,000股\n7.原股東認購比率:本次增資發行新股之90%，計13,500,000股\n8.公開銷售方式及股數:不適用\n9.畸零股及逾期未認購股份之處理方式:\n認購不足一股之畸零股，由股東自停止過戶日起五日內自行向本公司\n股務代理機構辦理拼湊一整股認購，逾期未辦理及原股東及員工放棄認購\n或拼湊湊不足一股之畸零股部份，擬請董事會授權董事長洽特定人按發行　\n價格認購之。\n10.本次發行新股之權利義務:\n本次現金增資發行新股之權利義務與原已發行股份相同。\n11.本次增資資金用途:充實營運資金。\n12.現金增資認股基準日:115/01/27\n13.最後過戶日:115/01/22\n14.停止過戶起始日期:115/01/23\n15.停止過戶截止日期:115/01/27\n16.股款繳納期間:\n員工及原股東繳款期間:115/02/06~115/03/06\n特定人繳款期間:115/03/09~115/03/13\n17.與代收及專戶存儲價款行庫訂約日期:不適用\n18.委託代收款項機構:不適用\n19.委託存儲款項機構:不適用\n20.其他應敘明事項:\n授權董事長視實際需要調整，可重新訂定增資基準日相關事宜。""]], ""footer"": [""以上資料均由各公司依發言當時所屬市場別之規定申報後，由本系統對外公佈，資料如有虛偽不實，均由該公司負責。""], ""header"": {""note"": [], ""subTitle"": [], ""mainTitle"": [""公司當日重大訊息之詳細內容""]}, ""titles"": [{""sub"": [], ""main"": ""序號""}, {""sub"": [], ""main"": ""發言日期""}, {""sub"": [], ""main"": ""發言時間""}, {""sub"": [], ""main"": ""發言人""}, {""sub"": [], ""main"": ""發言人職稱""}, {""sub"": [], ""main"": ""發言人電話""}, {""sub"": [], ""main"": ""主旨""}, {""sub"": [], ""main"": ""符合條款""}, {""sub"": [], ""main"": ""事實發生日""}, {""sub"": [], ""main"": ""說明""}], ""companyAbbreviation"": ""新漢""}, ""datetime"": ""115/01/09 23:46:48""}",2026-01-09 23:46:27
1150109|otc|4747|1,115/01/09,18:07:45,4747,強生製藥,補充公告本公司董事會決議通過投資有價證券,有價證券,1150109,otc,1,"{""code"": 200, ""message"": ""查詢成功"", ""result"": {""marketName"": ""上櫃公司"", ""companyId"": ""4747"", ""data"": [[1, ""115/01/09"", ""18:07:45"", ""林俊巍"", ""營業部經理"", ""(02)2989-4756"", ""補充公告本公司董事會決議通過投資有價證券"", ""20"", ""115/01/08"", ""1.證券名稱:\r\n健亞生物科技股份有限公司 普通股\r\n2.交易日期:114/11/6~115/1/8\r\n3.董事會通過日期: 民國114年12月24日\r\n4.其他核決日期: 不適用\r\n5.交易數量、每單位價格及交易總金額:\r\n累積交易總金額新台幣7.4億元以內，於集中交易市場分次買進股票\r\n6.處分利益（或損失）（取得有價證券者不適用）:\r\n不適用\r\n7.與交易標的公司之關係:\r\n無\r\n8.迄目前為止，累積持有本交易證券（含本次交易）之數量、金額、持股\r\n比例及權利受限情形（如質押情形）:\r\n截至115年1月8日止，\r\n本公司持有健亞股數：15,929,000股，\r\n總投資金額：新台幣473,017,409元，\r\n持股比例：13.86%\r\n9.迄目前為止，依「公開發行公司取得或處分資產處理準則」第三條所列之有價證券投\r\n資（含本次交易）占公司最近期財務報表中總資產及歸屬於母公司業主之權益之比例\r\n暨最近期財務報表中營運資金數額:\r\n占公司最近期財務報表中總資產比例：24.09% \r\n占歸屬於母公司業主之權益之比例：27.76%\r\n最近期財務報表中營運資金數額：新台幣1,157,422仟元\r\n10.取得或處分之具體目的:\r\n長期投資。\r\n11.本次交易表示異議董事之意見:\r\n無。\r\n12.本次交易為關係人交易:\r\n否\r\n13.交易相對人及其與公司之關係:\r\n不適用\r\n14.監察人承認或審計委員會同意日期:\r\n民國114年12月24日\r\n15.前已就同一件事件發布重大訊息日期: 不適用\r\n16.其他敘明事項:\r\n無""]], ""footer"": [""以上資料均由各公司依發言當時所屬市場別之規定申報後，由本系統對外公佈，資料如有虛偽不實，均由該公司負責。""], ""header"": {""note"": [], ""subTitle"": [], ""mainTitle"": [""公司當日重大訊息之詳細內容""]}, ""titles"": [{""sub"": [], ""main"": ""序號""}, {""sub"": [], ""main"": ""發言日期""}, {""sub"": [], ""main"": ""發言時間""}, {""sub"": [], ""main"": ""發言人""}, {""sub"": [], ""main"": ""發言人職稱""}, {""sub"": [], ""main"": ""發言人電話""}, {""sub"": [], ""main"": ""主旨""}, {""sub"": [], ""main"": ""符合條款""}, {""sub"": [], ""main"": ""事實發生日""}, {""sub"": [], ""main"": ""說明""}], ""companyAbbreviation"": ""強生製藥""}, ""datetime"": ""115/01/09 23:46:48""}",2026-01-09 23:46:27
1150108|rotc|5262|1,115/01/08,18:11:33,5262,立達,公告本公司2025年12月份自結合併營收,自結合併,1150108,rotc,1,"{""code"": 200, ""message"": ""查詢成功"", ""result"": {""marketName"": ""興櫃公司"", ""companyId"": ""5262"", ""data"": [[1, ""115/01/08"", ""18:11:33"", ""何弘竣"", ""副總經理"", ""02-26582588"", ""公告本公司2025年12月份自結合併營收"", ""44"", ""115/01/08"", ""1.事實發生日:115/01/08\n2.公司名稱:立達國際電子股份有限公司\n3.與公司關係(請輸入本公司或子公司):本公司\n4.相互持股比例:不適用\n5.發生緣由:公告本公司2025年12月份自結合併營收\n6.因應措施:無\n7.其他應敘明事項(若事件發生或決議之主體係屬公開發行以上公司，\n本則重大訊息同時符合證券交易法施行細則第7條第9款所定\n對股東權益或證券價格有重大影響之事項):\n(1)本公司2025年12月份合併營收為新台幣2.49億元。\n(a)比去年12月新台幣3.02億元，減少17.37%。\n(b)比今年11月新台幣1.82億元，成長37.15%。\n(c)2025年累計合併營收為新台幣20.60億元，\n比去年同期新台幣25.80億元，減少20.16%。\n(2)本月自有品牌，包含記憶卡，電腦週邊，手機週邊等零售包的B2C通路產品，\n合併營收淨額共計新台幣1.75億元，佔整體合併營收70.18%。\n(a)比去年12月新台幣2.25億元，減少22.17%。\n(b)比今年11月新台幣1.24億元，成長40.50%。\n(3)本公司民國114年12月合併營業收入係依循會計研究發展基金會114年1月22日\n(114)基秘字第0000000009號函以總額認列，\n相關比較期之營業收入金額亦據此重新列示。""]], ""footer"": [""以上資料均由各公司依發言當時所屬市場別之規定申報後，由本系統對外公佈，資料如有虛偽不實，均由該公司負責。""], ""header"": {""note"": [], ""subTitle"": [], ""mainTitle"": [""公司當日重大訊息之詳細內容""]}, ""titles"": [{""sub"": [], ""main"": ""序號""}, {""sub"": [], ""main"": ""發言日期""}, {""sub"": [], ""main"": ""發言時間""}, {""sub"": [], ""main"": ""發言人""}, {""sub"": [], ""main"": ""發言人職稱""}, {""sub"": [], ""main"": ""發言人電話""}, {""sub"": [], ""main"": ""主旨""}, {""sub"": [], ""main"": ""符合條款""}, {""sub"": [], ""main"": ""事實發生日""}, {""sub"": [], ""main"": ""說明""}], ""companyAbbreviation"": ""立達""}, ""datetime"": ""115/01/09 23:46:49""}",2026-01-09 23:46:27
1150106|rotc|4172|4,115/01/09,15:16:06,4172,因華,公告本公司現金增資委託代收價款及存儲專戶機構,現金增資,1150106,rotc,4,"{""code"": 200, ""message"": ""查詢成功"", ""result"": {""marketName"": ""興櫃公司"", ""companyId"": ""4172"", ""data"": [[4, ""115/01/09"", ""15:16:06"", ""郝為華"", ""總經理"", ""02-87977607"", ""公告本公司現金增資委託代收價款及存儲專戶機構"", ""9"", ""115/01/09"", ""1.董事會決議或公司決定日期:115/01/09\n2.發行股數:12,000,000股\n3.每股面額:新台幣10元整\n4.發行總金額:120,000,000元整\n5.發行價格:每股新台幣15元整\n6.員工認股股數:保留發行新股總數15%之股份計1,800,000股由本公司員工認購。\n7.原股東認購比例(另請說明每仟股暫定得認購股數):\n 本次發行新股總數85%之股份計10,200,000股，由原股東按認股基準日股東名簿記載之\n 持股比率認購，每仟股可認購94.81712843股。\n8.公開銷售方式及股數:不適用\n9.畸零股及逾期未認購股份之處理方式:原股東認購不足一股之畸零股，自停止過戶日\n 起5日內由股東自行併湊；原股東及員工放棄認股之股份或併湊不足一股之畸零股，\n 授權董事長洽特定人按發行價格認購。\n10.本次發行新股之權利義務:與原發行之普通股股份相同。\n11.本次增資資金用途:充實營運資金\n12.現金增資認股基準日:115/01/27\n13.最後過戶日:115/01/22\n14.停止過戶起始日期:115/01/23\n15.停止過戶截止日期:115/01/27\n16.股款繳納期間:115/02/02~115/02/11\n17.與代收及專戶存儲價款行庫訂約日期:115/01/09。\n18.委託代收款項機構:彰化商業銀行東興分行及全國各分行。\n19.委託存儲款項機構:彰化商業銀行五分埔分行。\n20.其他應敘明事項:\n(1)本公司114年現金增資發行新股業經金融監督管理委員會114年10月31日金管證發字第　\n1140361669號函申報生效在案暨114年11月28日金管證發字第1140366082號函申請延長募\n集期間核准在案及115年1月2日金管證發字第1140368919號函申請計畫變更案核准在案。\n(2)本次現金增資發行新股其他有關事宜，若因主管機關指示修正或因主客觀\n   環境需要修正或調整時，授權董事長全權處理。""]], ""footer"": [""以上資料均由各公司依發言當時所屬市場別之規定申報後，由本系統對外公佈，資料如有虛偽不實，均由該公司負責。""], ""header"": {""note"": [], ""subTitle"": [], ""mainTitle"": [""公司當日重大訊息之詳細內容""]}, ""titles"": [{""sub"": [], ""main"": ""序號""}, {""sub"": [], ""main"": ""發言日期""}, {""sub"": [], ""main"": ""發言時間""}, {""sub"": [], ""main"": ""發言人""}, {""sub"": [], ""main"": ""發言人職稱""}, {""sub"": [], ""main"": ""發言人電話""}, {""sub"": [], ""main"": ""主旨""}, {""sub"": [], ""main"": ""符合條款""}, {""sub"": [], ""main"": ""事實發生日""}, {""sub"": [], ""main"": ""說明""}], ""companyAbbreviation"": ""因華""}, ""datetime"": ""115/01/09 23:46:49""}",2026-01-09 23:46:27
1150109|rotc|6876|1,115/01/09,15:50:09,6876,朗齊生醫*,公告本公司115年第一次現金增資發行新股認股基準日及相關事宜,現金增資,1150109,rotc,1,"{""code"": 200, ""message"": ""查詢成功"", ""result"": {""marketName"": ""興櫃公司"", ""companyId"": ""6876"", ""data"": [[1, ""115/01/09"", ""15:50:09"", ""嚴世峯"", ""副總經理兼財務長"", ""04-23205691"", ""公告本公司115年第一次現金增資發行新股認股基準日\r\n及相關事宜"", ""9"", ""115/01/09"", ""1.董事會決議或公司決定日期:115/01/09\n2.發行股數:23,000,000股\n3.每股面額:無面額\n4.發行總金額:新台幣506,000,000元\n5.發行價格:新台幣22元\n6.員工認股股數:依公司法規定保留15%，計3,450,000股由員工認購。\n7.原股東認購比例(另請說明每仟股暫定得認購股數):\n 增資發行股數之85%，計19,550,000股由原股東按認股基準日股東\n 名簿記載之持股比例，依本公司普通股發行股份總數46,612,543股\n 計算，每仟股認購419.41500595股。\n8.公開銷售方式及股數:不適用\n9.畸零股及逾期未認購股份之處理方式:\n 認購不足一股之畸零股，股東得於停止過戶日起5日內向本公司股\n 務代理機構辦理併湊成整股認購，未併湊及逾期未認購或認購不\n 足之畸零股，授權董事長洽特定人按發行價格認購之。\n10.本次發行新股之權利義務:與原有普通股相同\n11.本次增資資金用途:公司營運資金需求及支付新藥開發臨床費用\n12.現金增資認股基準日:115/02/02\n13.最後過戶日:115/01/28\n14.停止過戶起始日期:115/01/29\n15.停止過戶截止日期:115/02/02\n16.股款繳納期間:\n員工及原股東繳款期間:自115年02月05日至115年03月06日止\n特定人繳款期間:自115年03月09日至115年03月16日止\n17.與代收及專戶存儲價款行庫訂約日期:115年01月09日\n18.委託代收款項機構:中國信託商業銀行黎明分行。\n19.委託存儲款項機構:中國信託商業銀行市政分行。\n20.其他應敘明事項:\n(1)本次現金增資發行新股案業經金融監督管理委員會115年01月08日\n   金管證發字第1140369141號函申報生效在案。\n(2)本次現金增資發行新股其他相關未盡事宜，如因主管機關修正或\n   基於營運評估及因客觀環境需要變更時程及相關增資作業，授權\n   董事長全權處理。""]], ""footer"": [""以上資料均由各公司依發言當時所屬市場別之規定申報後，由本系統對外公佈，資料如有虛偽不實，均由該公司負責。""], ""header"": {""note"": [], ""subTitle"": [], ""mainTitle"": [""公司當日重大訊息之詳細內容""]}, ""titles"": [{""sub"": [], ""main"": ""序號""}, {""sub"": [], ""main"": ""發言日期""}, {""sub"": [], ""main"": ""發言時間""}, {""sub"": [], ""main"": ""發言人""}, {""sub"": [], ""main"": ""發言人職稱""}, {""sub"": [], ""main"": ""發言人電話""}, {""sub"": [], ""main"": ""主旨""}, {""sub"": [], ""main"": ""符合條款""}, {""sub"": [], ""main"": ""事實發生日""}, {""sub"": [], ""main"": ""說明""}], ""companyAbbreviation"": ""朗齊生醫*""}, ""datetime"": ""115/01/09 23:46:50""}",2026-01-09 23:46:27
1150109|rotc|4590|2,115/01/09,16:04:54,4590,富田,公告本公司股票初次創新板上市前現金增資委託代收及存儲專戶行庫,現金增資,1150109,rotc,2,"{""code"": 200, ""message"": ""查詢成功"", ""result"": {""marketName"": ""興櫃公司"", ""companyId"": ""4590"", ""data"": [[2, ""115/01/09"", ""16:04:54"", ""林宗達"", ""副總經理"", ""037-980799"", ""公告本公司股票初次創新板上市前現金增資委託代收及存儲\r\n專戶行庫"", ""44"", ""115/01/09"", ""1.事實發生日:115/01/09\n2.公司名稱:富田電機股份有限公司\n3.與公司關係(請輸入本公司或子公司):本公司\n4.相互持股比例:不適用\n5.發生緣由:依據「發行人募集與發行有價證券處理準則」規定辦理公告\n6.因應措施:無\n7.其他應敘明事項(若事件發生或決議之主體係屬公開發行以上公司，\n本則重大訊息同時符合證券交易法施行細則第7條第9款所定\n對股東權益或證券價格有重大影響之事項):\n(1)訂約日期：115/01/09\n(2)委託代收價款機構：\n   員工認股代收股款機構:合作金庫商業銀行南豐原分行\n   競價拍賣代收股款機構:第一商業銀行仁和分行\n(3)委託存儲價款機構：合作金庫商業銀行北屯分行""]], ""footer"": [""以上資料均由各公司依發言當時所屬市場別之規定申報後，由本系統對外公佈，資料如有虛偽不實，均由該公司負責。""], ""header"": {""note"": [], ""subTitle"": [], ""mainTitle"": [""公司當日重大訊息之詳細內容""]}, ""titles"": [{""sub"": [], ""main"": ""序號""}, {""sub"": [], ""main"": ""發言日期""}, {""sub"": [], ""main"": ""發言時間""}, {""sub"": [], ""main"": ""發言人""}, {""sub"": [], ""main"": ""發言人職稱""}, {""sub"": [], ""main"": ""發言人電話""}, {""sub"": [], ""main"": ""主旨""}, {""sub"": [], ""main"": ""符合條款""}, {""sub"": [], ""main"": ""事實發生日""}, {""sub"": [], ""main"": ""說明""}], ""companyAbbreviation"": ""富田""}, ""datetime"": ""115/01/09 23:46:50""}",2026-01-09 23:46:27
1150109|rotc|4590|3,115/01/09,16:11:24,4590,富田,公告本公司股票初次創新板上市前現金增資發行新股相關事宜,現金增資,1150109,rotc,3,"{""code"": 200, ""message"": ""查詢成功"", ""result"": {""marketName"": ""興櫃公司"", ""companyId"": ""4590"", ""data"": [[3, ""115/01/09"", ""16:11:24"", ""林宗達"", ""副總經理"", ""037-980799"", ""公告本公司股票初次創新板上市前現金增資發行新股相關事宜"", ""44"", ""115/01/09"", ""1.事實發生日:115/01/09\n2.公司名稱:富田電機股份有限公司\n3.與公司關係(請輸入本公司或子公司):本公司\n4.相互持股比例:不適用\n5.發生緣由:公告本公司股票創新板初次上市前現金增資發行新股相關事宜\n6.因應措施:無\n7.其他應敘明事項(若事件發生或決議之主體係屬公開發行以上公司，\n本則重大訊息同時符合證券交易法施行細則第7條第9款所定\n對股東權益或證券價格有重大影響之事項):\n一、本公司為配合初次創新板上市前公開承銷辦理現金增資發行普通股3,500,000股，\n    每股面額新台幣10元，總額新台幣35,000,000元，業經臺灣證券交易所股份有限\n    公司114年12月19日臺證上二字第1141705291號函申報生效在案。\n二、本次現金增資發行新股依公司法第267條規定，保留本次發行股數之15%，計\n    525,000股由員工認購，員工若認購不足或放棄之股份，授權董事長洽特定人認購\n    之。其餘85%，計2,975,000股，依法令規定及本公司112年06月30日股東常會決\n    議，由原股東放棄認購並全數委由證券承銷商辦理上市前公開承銷，對外公開承銷\n    認購不足部分，依「中華民國證券商業同業公會證券商承銷或再行銷售有價證券處\n    理辦法」規定辦理之。\n三、本次現金增資發行普通股3,500,000股，每股面額新臺幣10元，計新台幣\n    35,000,000元，以競價拍賣方式辦理承銷。競價拍賣最低承銷價格係以向中華民國\n    證券商業同業公會申報競價拍賣約定書前興櫃有成交之30個營業日其成交均價扣除\n    無償配股除權(或減資除權)及除息後簡單算術平均數之七成為上限，訂為每股新臺\n    幣54.05元(競價拍賣底價)，依投標價格高者優先得標，每一得標人應依其得標價\n    格認購，公開承銷價格則以各得標單之價格及其數量加權平均所得之價格為之，並\n    以最低承銷價格之1.11倍為上限，故每股發行價格暫定以新臺幣60元溢價發行。\n四、本次現金增資之發行價格、發行條件、募集金額、資金計劃之用途及其他相關事\n    項，包括依主管機關指示或因客觀環境變更而有修正需要變更時，授權董事長全權\n    處理。\n五、本次現金增資發行新股認股繳款期間：\n    (1)競價拍賣期間：115/01/14~115/01/16\n    (2)員工認股繳款期間：115/01/21~115/01/23\n    (3)競價拍賣扣款日期：115/01/20\n    (4)特定人認股繳款日期：115/01/26\n    (5)增資基準日：115/01/27\n六、本次現金增資發行之新股，其權利義務與已發行之普通股股份相同。""]], ""footer"": [""以上資料均由各公司依發言當時所屬市場別之規定申報後，由本系統對外公佈，資料如有虛偽不實，均由該公司負責。""], ""header"": {""note"": [], ""subTitle"": [], ""mainTitle"": [""公司當日重大訊息之詳細內容""]}, ""titles"": [{""sub"": [], ""main"": ""序號""}, {""sub"": [], ""main"": ""發言日期""}, {""sub"": [], ""main"": ""發言時間""}, {""sub"": [], ""main"": ""發言人""}, {""sub"": [], ""main"": ""發言人職稱""}, {""sub"": [], ""main"": ""發言人電話""}, {""sub"": [], ""main"": ""主旨""}, {""sub"": [], ""main"": ""符合條款""}, {""sub"": [], ""main"": ""事實發生日""}, {""sub"": [], ""main"": ""說明""}], ""companyAbbreviation"": ""富田""}, ""datetime"": ""115/01/09 23:46:51""}",2026-01-09 23:46:27
1150109|rotc|6786|1,115/01/09,17:00:09,6786,芯測,本公司114年第二次現金增資收足股款及增資基準日公告,現金增資,1150109,rotc,1,"{""code"": 200, ""message"": ""查詢成功"", ""result"": {""marketName"": ""興櫃公司"", ""companyId"": ""6786"", ""data"": [[1, ""115/01/09"", ""17:00:09"", ""王筱萍"", ""副總經理"", ""(03)560-1667"", ""本公司114年第二次現金增資收足股款及增資基準日公告"", ""44"", ""115/01/09"", ""1.事實發生日:115/01/09\n2.公司名稱:芯測科技股份有限公司\n3.與公司關係(請輸入本公司或子公司):本公司\n4.相互持股比例:不適用\n5.發生緣由:依據發行人募集與發行有價證券處理準則辦理公告\n6.因應措施:無。\n7.其他應敘明事項(若事件發生或決議之主體係屬公開發行以上公司，\n本則重大訊息同時符合證券交易法施行細則第7條第9款所定\n對股東權益或證券價格有重大影響之事項):\n (1)本公司114年第二次現金增資發行股數2,500千股，每股發行價格\n 新台幣33元，實收股款總金額新台幣82,500千元，已全數收足。\n (2)本次現金增資基準日為115/01/12。""]], ""footer"": [""以上資料均由各公司依發言當時所屬市場別之規定申報後，由本系統對外公佈，資料如有虛偽不實，均由該公司負責。""], ""header"": {""note"": [], ""subTitle"": [], ""mainTitle"": [""公司當日重大訊息之詳細內容""]}, ""titles"": [{""sub"": [], ""main"": ""序號""}, {""sub"": [], ""main"": ""發言日期""}, {""sub"": [], ""main"": ""發言時間""}, {""sub"": [], ""main"": ""發言人""}, {""sub"": [], ""main"": ""發言人職稱""}, {""sub"": [], ""main"": ""發言人電話""}, {""sub"": [], ""main"": ""主旨""}, {""sub"": [], ""main"": ""符合條款""}, {""sub"": [], ""main"": ""事實發生日""}, {""sub"": [], ""main"": ""說明""}], ""companyAbbreviation"": ""芯測""}, ""datetime"": ""115/01/09 23:46:51""}",2026-01-09 23:46:27
