key,speech_date,speech_time,company_id,company_name,subject,matched_keywords,enterDate,marketKind,serialNumber,detail_json,fetched_at_tw
1150109|sii|2239|1,115/01/09,16:07:48,2239,英利-KY,公告本公司買回庫藏股期間屆滿及執行情形,庫藏股,1150109,sii,1,"{""code"": 200, ""message"": ""查詢成功"", ""result"": {""marketName"": ""上市公司"", ""companyId"": ""2239"", ""data"": [[1, ""115/01/09"", ""16:07:48"", ""白秉諺"", ""副理"", ""(886)966-012-239"", ""公告本公司買回庫藏股期間屆滿及執行情形"", ""35"", ""115/01/10"", ""1.原預定買回股份總金額上限(元):9,646,528,031\r\n2.原預定買回之期間:114/11/12~115/01/10\r\n3.原預定買回之數量(股):5,000,000\r\n4.原預定買回區間價格(元):21.75~47.80\r\n5.本次實際買回期間:114/11/14~115/01/09\r\n6.本次已買回股份數量(股):2,634,000\r\n7.本次已買回股份總金額(元):91,365,724\r\n8.本次平均每股買回價格(元):34.69\r\n9.累積已持有自己公司股份數量(股):2,634,000\r\n10.累積已持有自己公司股份數量占公司已發行股份總數之比率(%):2.19\r\n11.本次未執行完畢之原因:\r\n基於維護股東權益並兼顧市場機制，本公司視股價變化及成交量狀況採取分批買回策略，故未全數執行完畢。\r\n12.其他應敘明事項:\r\n庫藏股預定買回之期間為114年11月12日至115年1月10日，因115年1月10日非屬營業日，故於115年1月9日\r\n提前公告之。""]], ""footer"": [""以上資料均由各公司依發言當時所屬市場別之規定申報後，由本系統對外公佈，資料如有虛偽不實，均由該公司負責。""], ""header"": {""note"": [], ""subTitle"": [], ""mainTitle"": [""公司當日重大訊息之詳細內容""]}, ""titles"": [{""sub"": [], ""main"": ""序號""}, {""sub"": [], ""main"": ""發言日期""}, {""sub"": [], ""main"": ""發言時間""}, {""sub"": [], ""main"": ""發言人""}, {""sub"": [], ""main"": ""發言人職稱""}, {""sub"": [], ""main"": ""發言人電話""}, {""sub"": [], ""main"": ""主旨""}, {""sub"": [], ""main"": ""符合條款""}, {""sub"": [], ""main"": ""事實發生日""}, {""sub"": [], ""main"": ""說明""}], ""companyAbbreviation"": ""英利-KY""}, ""datetime"": ""115/01/09 23:46:38""}",2026-01-09 23:46:27
1150109|sii|2454|1,115/01/09,16:55:41,2454,聯發科,聯發科技114年12月份自結合併營收淨額公告,自結合併,1150109,sii,1,"{""code"": 200, ""message"": ""查詢成功"", ""result"": {""marketName"": ""上市公司"", ""companyId"": ""2454"", ""data"": [[1, ""115/01/09"", ""16:55:41"", ""顧大為"", ""財務長"", ""(03)5670766"", ""聯發科技114年12月份自結合併營收淨額公告"", ""51"", ""115/01/09"", ""1.事實發生日:115/01/09\n2.公司名稱:聯發科技股份有限公司\n3.與公司關係(請輸入本公司或子公司):本公司\n4.相互持股比例:不適用\n5.發生緣由:\n聯發科技一百一十四年十二月份自結合併營收淨額為新台幣512億6仟6佰萬元，\n較前月合併營收淨額新台幣468億9仟6佰萬元增加9.32%。\n6.因應措施:無\n7.其他應敘明事項(若事件發生或決議之主體係屬公開發行以上公司，本則重大訊息同時\n  符合證券交易法施行細則第7條第9款所定對股東權益或證券價格有重大影響之事項):無""]], ""footer"": [""以上資料均由各公司依發言當時所屬市場別之規定申報後，由本系統對外公佈，資料如有虛偽不實，均由該公司負責。""], ""header"": {""note"": [], ""subTitle"": [], ""mainTitle"": [""公司當日重大訊息之詳細內容""]}, ""titles"": [{""sub"": [], ""main"": ""序號""}, {""sub"": [], ""main"": ""發言日期""}, {""sub"": [], ""main"": ""發言時間""}, {""sub"": [], ""main"": ""發言人""}, {""sub"": [], ""main"": ""發言人職稱""}, {""sub"": [], ""main"": ""發言人電話""}, {""sub"": [], ""main"": ""主旨""}, {""sub"": [], ""main"": ""符合條款""}, {""sub"": [], ""main"": ""事實發生日""}, {""sub"": [], ""main"": ""說明""}], ""companyAbbreviation"": ""聯發科""}, ""datetime"": ""115/01/09 23:46:39""}",2026-01-09 23:46:27
1150109|sii|3032|1,115/01/09,17:19:27,3032,偉訓,公告本公司114年12月份自結合併營業收入,自結合併,1150109,sii,1,"{""code"": 200, ""message"": ""查詢成功"", ""result"": {""marketName"": ""上市公司"", ""companyId"": ""3032"", ""data"": [[1, ""115/01/09"", ""17:19:27"", ""李家慶"", ""總經理"", ""06-3560606"", ""公告本公司114年12月份自結合併營業收入"", ""51"", ""115/01/09"", ""1.事實發生日:115/01/09\n2.公司名稱:偉訓科技股份有限公司\n3.與公司關係(請輸入本公司或子公司):本公司\n4.相互持股比例:不適用。\n5.發生緣由:\n一、本公司114年12月份自結合併營業收入為新台幣969,905仟元\n    較去年同期增加49%。\n二、累計至12月份自結合併營業收入為新台幣11,137,226仟元\n  ，較去年同期增加50%。\n三、以上資訊係本公司初步自行結算結果，並未經會計師簽證或核閱。\n四、前述詳細資料業已輸入公開資訊觀測站資訊系統，網址\n     http://mops.twse.com.tw。\n6.因應措施:無。\n7.其他應敘明事項(若事件發生或決議之主體係屬公開發行以上公司，本則重大訊息同時\n  符合證券交易法施行細則第7條第9款所定對股東權益或證券價格有重大影響之事項):\n無。""]], ""footer"": [""以上資料均由各公司依發言當時所屬市場別之規定申報後，由本系統對外公佈，資料如有虛偽不實，均由該公司負責。""], ""header"": {""note"": [], ""subTitle"": [], ""mainTitle"": [""公司當日重大訊息之詳細內容""]}, ""titles"": [{""sub"": [], ""main"": ""序號""}, {""sub"": [], ""main"": ""發言日期""}, {""sub"": [], ""main"": ""發言時間""}, {""sub"": [], ""main"": ""發言人""}, {""sub"": [], ""main"": ""發言人職稱""}, {""sub"": [], ""main"": ""發言人電話""}, {""sub"": [], ""main"": ""主旨""}, {""sub"": [], ""main"": ""符合條款""}, {""sub"": [], ""main"": ""事實發生日""}, {""sub"": [], ""main"": ""說明""}], ""companyAbbreviation"": ""偉訓""}, ""datetime"": ""115/01/09 23:46:39""}",2026-01-09 23:46:27
1150109|sii|3036|1,115/01/09,17:36:21,3036,文曄,本公司114年12月份自結合併營收約新台幣986億元,自結合併,1150109,sii,1,"{""code"": 200, ""message"": ""查詢成功"", ""result"": {""marketName"": ""上市公司"", ""companyId"": ""3036"", ""data"": [[1, ""115/01/09"", ""17:36:21"", ""林冠男"", ""副總經理"", ""(02)8226-9088"", ""本公司114年12月份自結合併營收約新台幣986億元"", ""51"", ""115/01/09"", ""1.事實發生日:115/01/09\n2.公司名稱:文曄科技股份有限公司\n3.與公司關係(請輸入本公司或子公司):本公司\n4.相互持股比例:不適用\n5.發生緣由:不適用\n6.因應措施:不適用\n7.其他應敘明事項(若事件發生或決議之主體係屬公開發行以上公司，本則重大訊息同時\n  符合證券交易法施行細則第7條第9款所定對股東權益或證券價格有重大影響之事項):\n 本公司公佈2025年12月份自結合併營收約新台幣986億元，較去年同期合併營收增加\n約2.9%，較前月合併營收減少約15.4%。2025年第四季自結合併營收約新台幣3,421億\n元，與2024年同期營收相比成長約30.6%。2025年全年自結合併營收約新台幣1.18兆\n元，與2024年相較年增率約達22.8%。""]], ""footer"": [""以上資料均由各公司依發言當時所屬市場別之規定申報後，由本系統對外公佈，資料如有虛偽不實，均由該公司負責。""], ""header"": {""note"": [], ""subTitle"": [], ""mainTitle"": [""公司當日重大訊息之詳細內容""]}, ""titles"": [{""sub"": [], ""main"": ""序號""}, {""sub"": [], ""main"": ""發言日期""}, {""sub"": [], ""main"": ""發言時間""}, {""sub"": [], ""main"": ""發言人""}, {""sub"": [], ""main"": ""發言人職稱""}, {""sub"": [], ""main"": ""發言人電話""}, {""sub"": [], ""main"": ""主旨""}, {""sub"": [], ""main"": ""符合條款""}, {""sub"": [], ""main"": ""事實發生日""}, {""sub"": [], ""main"": ""說明""}], ""companyAbbreviation"": ""文曄""}, ""datetime"": ""115/01/09 23:46:40""}",2026-01-09 23:46:27
1150109|sii|3189|2,115/01/09,17:42:35,3189,景碩,公告本公司現金增資發行新股認股基準日等相關事宜,現金增資,1150109,sii,2,"{""code"": 200, ""message"": ""查詢成功"", ""result"": {""marketName"": ""上市公司"", ""companyId"": ""3189"", ""data"": [[2, ""115/01/09"", ""17:42:35"", ""穆顯爵"", ""資深專案處長"", ""(03)4871919"", ""公告本公司現金增資發行新股認股基準日等相關事宜"", ""11"", ""115/01/09"", ""1.董事會決議或公司決定增資基準日期:115/01/09\n2.是否採總括申報發行新股(是，請併敘明預定發行期間/否):否\n3.主管機關申報生效日期:114/12/29\n4.董事會決議(追補)發行日期:114/10/27\n5.發行總金額及股數:\n(1)發行總金額：發行總面額新台幣700,000,000元\n(2)發行總股數：70,000,000股\n6.採總括申報發行新股案件，本次發行金額及股數:不適用\n7.採總括申報發行新股案件，本次發行後，剩餘之金額及股數餘額:不適用\n8.每股面額:新台幣10元\n9.發行價格:實際發行價格依「中華民國證券商業同業公會承銷商會員輔導發行公司\n募集與發行有價證券自律規則」規定，於定價後另行公告。\n10.員工認股股數:依公司法第267條規定，保留發行新股總額之15%，計10,500,000股由本\n公司員工認購。\n11.原股東認購比率:本次現金增資發行新股總額之75%，計52,500,000股由原股東按\n認股基準日股東名簿所載之持股比例認購，每仟股得認購114.89886842股(按本公\n司115年01月09日實際流通在外股數456,812,660股扣除未達既得條件待註銷之限制\n員工權利新股23,100股加計既得條件已發行之限制員工權利新股134,000股計算後，\n每仟股得認購)。\n12.公開銷售方式及股數:依證券交易法第28之1條規定，提撥發行新股總額之10%，計\n7,000,000股對外公開承銷。\n13.畸零股及逾期未認購股份之處理方式:原股東可認購股數不足一股之畸零股，得由股東\n於停止過戶日起之五日內，逕向本公司股務代理機構辦理自行拼湊成整股認購，其拼湊\n後仍不足一股或逾期未拼湊之畸零股及原股東、員工放棄認購或認購不足之股份，授權\n董事長洽特定人按發行價格認購。\n14.本次發行新股之權利義務:本次現金增資採無實體發行，發行後其權利義務與原已發行\n普通股股份相同。\n15.本次增資資金用途:為償還銀行借款。\n16.現金增資認股基準日:115/02/01\n17.最後過戶日:115/01/27\n18.停止過戶起始日期:115/01/28\n19.停止過戶截止日期:115/02/01\n20.股款繳納期間:\n原股東及員工股款繳納期間:115/02/09~115/03/10\n特定人股款繳納期間:115/03/11~115/03/13\n21.與代收及專戶存儲價款行庫訂約日期:俟正式簽約後另行公告之。\n22.委託代收存款機構:俟正式簽約後另行公告之。\n23.委託存儲款項機構:俟正式簽約後另行公告之。\n24.其他應敘明事項:\n(1)本次現金增資發行普通股70,000,000股,每股面額新臺幣10元整，業經金融監督管理\n委員會114年12月29日金管證發字第1140367756號函申報生效在案。\n(2)本次現金增資之相關發行作業及其他未盡事宜，授權董事長全權處理。""]], ""footer"": [""以上資料均由各公司依發言當時所屬市場別之規定申報後，由本系統對外公佈，資料如有虛偽不實，均由該公司負責。""], ""header"": {""note"": [], ""subTitle"": [], ""mainTitle"": [""公司當日重大訊息之詳細內容""]}, ""titles"": [{""sub"": [], ""main"": ""序號""}, {""sub"": [], ""main"": ""發言日期""}, {""sub"": [], ""main"": ""發言時間""}, {""sub"": [], ""main"": ""發言人""}, {""sub"": [], ""main"": ""發言人職稱""}, {""sub"": [], ""main"": ""發言人電話""}, {""sub"": [], ""main"": ""主旨""}, {""sub"": [], ""main"": ""符合條款""}, {""sub"": [], ""main"": ""事實發生日""}, {""sub"": [], ""main"": ""說明""}], ""companyAbbreviation"": ""景碩""}, ""datetime"": ""115/01/09 23:46:40""}",2026-01-09 23:46:27
1150109|sii|5215|1,115/01/09,17:48:58,5215,科嘉-KY,代子公司蘇州嘉吉/科德/嘉財/艾普來/百宏/嘉皇/嘉駿公告一年內累積處分同一有價證券達實收資本額20%,有價證券,1150109,sii,1,"{""code"": 200, ""message"": ""查詢成功"", ""result"": {""marketName"": ""上市公司"", ""companyId"": ""5215"", ""data"": [[1, ""115/01/09"", ""17:48:58"", ""林志峰"", ""董事長"", ""(02)2243-6177"", ""代子公司蘇州嘉吉/科德/嘉財/艾普來/百宏/嘉皇/嘉駿 \r\n公告一年內累積處分同一有價證券達實收資本額20%"", ""20"", ""115/01/09"", ""1.證券名稱:\r\n上海證券交易所一天期國債逆回購GC001，代碼204001\r\n2.交易日期:115/1/9~115/1/9\r\n3.董事會通過日期: 不適用\r\n4.其他核決日期:\r\n核決層級:董事長核決\r\n民國115年01月09日\r\n5.交易數量、每單位價格及交易總金額:\r\n艾普來：91,680單位，均價：1.360%，\r\n百宏：64,520單位，均價：1.360%，\r\n嘉財：1,201,040單位，均價：1.350%，\r\n嘉皇：120,390單位，均價：1.360%\r\n嘉吉：118,090單位，均價：1.350%\r\n科德：520,890單位，均價：1.355%，\r\n嘉駿：406,480單位，均價：1.350%，\r\n總金額：252,337仟元，(約新台幣1,128,351千元)\r\n6.處分利益（或損失）（取得有價證券者不適用）:\r\n處份利益人民幣28仟元\r\n7.與交易標的公司之關係:\r\n非關係人\r\n8.迄目前為止，累積持有本交易證券（含本次交易）之數量、金額、持股\r\n比例及權利受限情形（如質押情形）:\r\n蘇州艾普來 無\r\n蘇州百宏 無\r\n蘇州嘉財電子 無\r\n蘇州嘉皇電子 無\r\n蘇州嘉吉電子 無\r\n蘇州科德 無\r\n重慶嘉駿 無\r\n質押情形：無\r\n9.迄目前為止，依「公開發行公司取得或處分資產處理準則」第三條所列之有價證券投\r\n資（含本次交易）占公司最近期財務報表中總資產及歸屬於母公司業主之權益之比例\r\n暨最近期財務報表中營運資金數額:\r\n總資產之比例：25.48%\r\n占股東權益之比例：33.09%\r\n營運資金：新台幣2,218,109仟元\r\n10.取得或處分之具體目的:\r\n投資理財\r\n11.本次交易表示異議董事之意見:\r\n無\r\n12.本次交易為關係人交易:\r\n否\r\n13.交易相對人及其與公司之關係:\r\n不適用\r\n14.監察人承認或審計委員會同意日期:\r\n不適用\r\n15.前已就同一件事件發布重大訊息日期: 不適用\r\n16.其他敘明事項:\r\n無""]], ""footer"": [""以上資料均由各公司依發言當時所屬市場別之規定申報後，由本系統對外公佈，資料如有虛偽不實，均由該公司負責。""], ""header"": {""note"": [], ""subTitle"": [], ""mainTitle"": [""公司當日重大訊息之詳細內容""]}, ""titles"": [{""sub"": [], ""main"": ""序號""}, {""sub"": [], ""main"": ""發言日期""}, {""sub"": [], ""main"": ""發言時間""}, {""sub"": [], ""main"": ""發言人""}, {""sub"": [], ""main"": ""發言人職稱""}, {""sub"": [], ""main"": ""發言人電話""}, {""sub"": [], ""main"": ""主旨""}, {""sub"": [], ""main"": ""符合條款""}, {""sub"": [], ""main"": ""事實發生日""}, {""sub"": [], ""main"": ""說明""}], ""companyAbbreviation"": ""科嘉-KY""}, ""datetime"": ""115/01/09 23:46:41""}",2026-01-09 23:46:27
1150109|sii|5215|2,115/01/09,17:49:16,5215,科嘉-KY,代子公司蘇州嘉吉/科德/嘉財/艾普來/百宏/嘉皇/嘉駿公告一年內累積取得同一有價證券達實收資本額20%,有價證券,1150109,sii,2,"{""code"": 200, ""message"": ""查詢成功"", ""result"": {""marketName"": ""上市公司"", ""companyId"": ""5215"", ""data"": [[2, ""115/01/09"", ""17:49:16"", ""林志峰"", ""董事長"", ""(02)2243-6177"", ""代子公司蘇州嘉吉/科德/嘉財/艾普來/百宏/嘉皇/嘉駿 \r\n公告一年內累積取得同一有價證券達實收資本額20%"", ""20"", ""115/01/09"", ""1.證券名稱:\r\n上海證券交易所一天期國債逆回購GC001，代碼204001\r\n2.交易日期:115/1/9~115/1/9\r\n3.董事會通過日期: 不適用\r\n4.其他核決日期:\r\n核決層級:董事長核決\r\n民國115年01月09日\r\n5.交易數量、每單位價格及交易總金額:\r\n艾普來：91,690單位，均價：1.415%，\r\n百宏：64,530單位，均價：1.420%，\r\n嘉財：1,201,170單位，均價：1.410%，\r\n嘉皇：120,400單位，均價：1.415%\r\n嘉吉：117,610單位，均價：1.405%\r\n科德：520,950單位，均價：1.410%，\r\n嘉駿：406,520單位，均價：1.411%，\r\n總金額：252,287仟元，(約新台幣1,128,127千元)\r\n6.處分利益（或損失）（取得有價證券者不適用）:\r\n不適用\r\n7.與交易標的公司之關係:\r\n非關係人\r\n8.迄目前為止，累積持有本交易證券（含本次交易）之數量、金額、持股\r\n比例及權利受限情形（如質押情形）:\r\n艾普來：91,690單位，均價：1.415%，\r\n百宏：64,530單位，均價：1.420%，\r\n嘉財：1,201,170單位，均價：1.410%，\r\n嘉皇：120,400單位，均價：1.415%\r\n嘉吉：117,610單位，均價：1.405%\r\n科德：520,950單位，均價：1.410%，\r\n嘉駿：406,520單位，均價：1.411%，\r\n質押情形：無\r\n9.迄目前為止，依「公開發行公司取得或處分資產處理準則」第三條所列之有價證券投\r\n資（含本次交易）占公司最近期財務報表中總資產及歸屬於母公司業主之權益之比例\r\n暨最近期財務報表中營運資金數額:\r\n總資產之比例：25.48%\r\n占股東權益之比例：33.09%\r\n營運資金：新台幣2,218,109仟元\r\n10.取得或處分之具體目的:\r\n投資理財\r\n11.本次交易表示異議董事之意見:\r\n無\r\n12.本次交易為關係人交易:\r\n否\r\n13.交易相對人及其與公司之關係:\r\n不適用\r\n14.監察人承認或審計委員會同意日期:\r\n不適用\r\n15.前已就同一件事件發布重大訊息日期: 不適用\r\n16.其他敘明事項:\r\n無""]], ""footer"": [""以上資料均由各公司依發言當時所屬市場別之規定申報後，由本系統對外公佈，資料如有虛偽不實，均由該公司負責。""], ""header"": {""note"": [], ""subTitle"": [], ""mainTitle"": [""公司當日重大訊息之詳細內容""]}, ""titles"": [{""sub"": [], ""main"": ""序號""}, {""sub"": [], ""main"": ""發言日期""}, {""sub"": [], ""main"": ""發言時間""}, {""sub"": [], ""main"": ""發言人""}, {""sub"": [], ""main"": ""發言人職稱""}, {""sub"": [], ""main"": ""發言人電話""}, {""sub"": [], ""main"": ""主旨""}, {""sub"": [], ""main"": ""符合條款""}, {""sub"": [], ""main"": ""事實發生日""}, {""sub"": [], ""main"": ""說明""}], ""companyAbbreviation"": ""科嘉-KY""}, ""datetime"": ""115/01/09 23:46:41""}",2026-01-09 23:46:27
1150109|sii|2323|1,115/01/09,17:55:44,2323,中環,公告本公司處分有價證券,有價證券,1150109,sii,1,"{""code"": 200, ""message"": ""查詢成功"", ""result"": {""marketName"": ""上市公司"", ""companyId"": ""2323"", ""data"": [[1, ""115/01/09"", ""17:55:44"", ""陳君煒"", ""財務部協理"", ""02-25989890"", ""公告本公司處分有價證券"", ""20"", ""115/01/09"", ""1.證券名稱:\r\n台積電 普通股\r\n2.交易日期:115/1/6~115/1/9\r\n3.董事會通過日期: 不適用\r\n4.其他核決日期:\r\n核決層級:董事長核決\r\n民國115年01月09日\r\n5.交易數量、每單位價格及交易總金額:\r\n交易數量(仟股):180\r\n每單位價格(元):1,688.17\r\n交易總金額(元):303,871,452\r\n6.處分利益（或損失）（取得有價證券者不適用）:\r\n處分利益 35,787,347元\r\n7.與交易標的公司之關係:\r\n無\r\n8.迄目前為止，累積持有本交易證券（含本次交易）之數量、金額、持股\r\n比例及權利受限情形（如質押情形）:\r\n持有餘額:487,000股、金額:718,655,325元  \r\n持股比例:0.002%、權利受限情形: 無\r\n9.迄目前為止，依「公開發行公司取得或處分資產處理準則」第三條所列之有價證券投\r\n資（含本次交易）占公司最近期財務報表中總資產及歸屬於母公司業主之權益之比例\r\n暨最近期財務報表中營運資金數額:\r\n占總資產比例:78.90% \r\n占歸屬於母公司業主之權益比例:110.79% \r\n營運資金數額:7,442,300仟元\r\n10.取得或處分之具體目的:\r\n投資組合\r\n11.本次交易表示異議董事之意見:\r\n無\r\n12.本次交易為關係人交易:\r\n否\r\n13.交易相對人及其與公司之關係:\r\n不適用\r\n14.監察人承認或審計委員會同意日期:\r\n不適用\r\n15.前已就同一件事件發布重大訊息日期: 不適用\r\n16.其他敘明事項:\r\n已於114/12/31授權有權交易人在115年第一季期間，得於集中交易市場進行有價證券交易""]], ""footer"": [""以上資料均由各公司依發言當時所屬市場別之規定申報後，由本系統對外公佈，資料如有虛偽不實，均由該公司負責。""], ""header"": {""note"": [], ""subTitle"": [], ""mainTitle"": [""公司當日重大訊息之詳細內容""]}, ""titles"": [{""sub"": [], ""main"": ""序號""}, {""sub"": [], ""main"": ""發言日期""}, {""sub"": [], ""main"": ""發言時間""}, {""sub"": [], ""main"": ""發言人""}, {""sub"": [], ""main"": ""發言人職稱""}, {""sub"": [], ""main"": ""發言人電話""}, {""sub"": [], ""main"": ""主旨""}, {""sub"": [], ""main"": ""符合條款""}, {""sub"": [], ""main"": ""事實發生日""}, {""sub"": [], ""main"": ""說明""}], ""companyAbbreviation"": ""中環""}, ""datetime"": ""115/01/09 23:46:42""}",2026-01-09 23:46:27
1150109|sii|2323|2,115/01/09,18:01:18,2323,中環,公告本公司處分有價證券,有價證券,1150109,sii,2,"{""code"": 200, ""message"": ""查詢成功"", ""result"": {""marketName"": ""上市公司"", ""companyId"": ""2323"", ""data"": [[2, ""115/01/09"", ""18:01:18"", ""陳君煒"", ""財務部協理"", ""02-25989890"", ""公告本公司處分有價證券"", ""20"", ""115/01/09"", ""1.證券名稱:\r\n穩懋 普通股\r\n2.交易日期:114/12/5~115/1/9\r\n3.董事會通過日期: 不適用\r\n4.其他核決日期:\r\n核決層級:董事長核決\r\n民國115年01月09日\r\n5.交易數量、每單位價格及交易總金額:\r\n交易數量(仟股):1,717\r\n每單位價格(元):188.13\r\n交易總金額(元):323,021,838\r\n6.處分利益（或損失）（取得有價證券者不適用）:\r\n處分利益17,308,451元\r\n7.與交易標的公司之關係:\r\n無\r\n8.迄目前為止，累積持有本交易證券（含本次交易）之數量、金額、持股\r\n比例及權利受限情形（如質押情形）:\r\n持有餘額:0 股、金額:0 元 \r\n持股比例:0.00%、權利受限情形:無\r\n9.迄目前為止，依「公開發行公司取得或處分資產處理準則」第三條所列之有價證券投\r\n資（含本次交易）占公司最近期財務報表中總資產及歸屬於母公司業主之權益之比例\r\n暨最近期財務報表中營運資金數額:\r\n占總資產比例:78.90%             \r\n占歸屬於母公司業主之權益比例:110.79%           \r\n營運資金數額:7,442,300仟元\r\n10.取得或處分之具體目的:\r\n投資組合\r\n11.本次交易表示異議董事之意見:\r\n無\r\n12.本次交易為關係人交易:\r\n否\r\n13.交易相對人及其與公司之關係:\r\n不適用\r\n14.監察人承認或審計委員會同意日期:\r\n不適用\r\n15.前已就同一件事件發布重大訊息日期: 不適用\r\n16.其他敘明事項:\r\n已於114/12/31授權有權交易人在115年第一季期間，得於集中交易市場進行有價證券交易""]], ""footer"": [""以上資料均由各公司依發言當時所屬市場別之規定申報後，由本系統對外公佈，資料如有虛偽不實，均由該公司負責。""], ""header"": {""note"": [], ""subTitle"": [], ""mainTitle"": [""公司當日重大訊息之詳細內容""]}, ""titles"": [{""sub"": [], ""main"": ""序號""}, {""sub"": [], ""main"": ""發言日期""}, {""sub"": [], ""main"": ""發言時間""}, {""sub"": [], ""main"": ""發言人""}, {""sub"": [], ""main"": ""發言人職稱""}, {""sub"": [], ""main"": ""發言人電話""}, {""sub"": [], ""main"": ""主旨""}, {""sub"": [], ""main"": ""符合條款""}, {""sub"": [], ""main"": ""事實發生日""}, {""sub"": [], ""main"": ""說明""}], ""companyAbbreviation"": ""中環""}, ""datetime"": ""115/01/09 23:46:42""}",2026-01-09 23:46:27
