key,speech_date,speech_time,company_id,company_name,subject,matched_keywords,enterDate,marketKind,serialNumber,detail_json,fetched_at_tw
1150114|sii|2313|1,115/01/14,17:33:20,2313,華通,係因本公司有價證券於集中交易市場達公布注意交易資訊標準，故公布相關財務業務等重大訊息，以利投資人區別瞭解,有價證券,1150114,sii,1,"{""code"": 200, ""message"": ""查詢成功"", ""result"": {""marketName"": ""上市公司"", ""companyId"": ""2313"", ""data"": [[1, ""115/01/14"", ""17:33:20"", ""呂  範"", ""財務處長"", ""(03)3231111"", ""係因本公司有價證券於集中交易市場達公布注意交易資\r\n訊標準，故公布相關財務業務等重大訊息，以利投資人區別\r\n瞭解"", ""51"", ""115/01/14"", ""1.事實發生日:115/01/14\n2.發生緣由:依據臺灣證券交易所股份有限公司通知辦理。\n3.財務業務資訊:\n\n期間         最近一月      與去年     最近一季      與去年    最近四季累計\n                                                              113年第4季至\n            114年12月    同期增減   114年第3季    同期增減      114年第3季\n            (IFRS合併                (IFRS合併                   (IFRS合併\n              自結數)                  核閱數)                     核閱數)\n          ========================= ======================= ==============\n科目           (金額)       (%)         (金額)        (%)        (金額)\n====      ============= =========== ============ ========== ==============\n營業收入        7,228       13.10      20,049       -0.70         74,812\n(百萬)\n稅前淨利(損)      817       35.94       2,753       19.94          7,663\n(百萬)\n歸屬母公司        683       52.12       2,155       19.92          5,958\n業主淨利\n(百萬)\n每股盈餘(元)     0.57       50.00        1.81       19.92           5.00\n\n4.有無「臺灣證券交易所股份有限公司對有價證券上市公司重大訊息之查證暨公開處理\n  程序」第4條所列重大訊息之情事（如「有」，請說明）:無\n5.有無「臺灣證券交易所股份有限公司對有價證券上市公司重大訊息之查證暨公開處理\n  程序」第11條所列重大訊息說明記者會之情事:無\n6.完整財務資訊請至公開資訊觀測站查閱，路徑如下：\n(1)近期營業收入及損益資訊：基本資料>精華版\n(2)歷史每月營業收入：營運概況>每月營收>採用IFRSs後之月營業收入資訊\n(3)歷史損益(會計師查核/核閱數)：財務報表>採IFRSs後>合併/個別報表>綜合損益表\n(4)歷史損益(自願性公告自結數)：營運概況>自結損益公告:\n7.其他應敘明事項:無""]], ""footer"": [""以上資料均由各公司依發言當時所屬市場別之規定申報後，由本系統對外公佈，資料如有虛偽不實，均由該公司負責。""], ""header"": {""note"": [], ""subTitle"": [], ""mainTitle"": [""公司當日重大訊息之詳細內容""]}, ""titles"": [{""main"": ""序號"", ""sub"": []}, {""main"": ""發言日期"", ""sub"": []}, {""main"": ""發言時間"", ""sub"": []}, {""main"": ""發言人"", ""sub"": []}, {""main"": ""發言人職稱"", ""sub"": []}, {""main"": ""發言人電話"", ""sub"": []}, {""main"": ""主旨"", ""sub"": []}, {""main"": ""符合條款"", ""sub"": []}, {""main"": ""事實發生日"", ""sub"": []}, {""main"": ""說明"", ""sub"": []}], ""companyAbbreviation"": ""華通""}, ""datetime"": ""115/01/15 15:24:04""}",2026-01-15 15:24:02
1150114|sii|2545|1,115/01/14,19:00:32,2545,皇翔,公告取得有價證券,有價證券,1150114,sii,1,"{""code"": 200, ""message"": ""查詢成功"", ""result"": {""marketName"": ""上市公司"", ""companyId"": ""2545"", ""data"": [[1, ""115/01/14"", ""19:00:32"", ""游玉華"", ""財務部副總"", ""23882898"", ""公告取得有價證券"", ""20"", ""115/01/14"", ""1.證券名稱:\r\n台達電子工業股份有限公司\r\n2.交易日期:114/10/20~115/1/14\r\n3.董事會通過日期: 不適用\r\n4.其他核決日期:\r\n核決層級:董事長核決\r\n民國115年1月14日\r\n5.交易數量、每單位價格及交易總金額:\r\n交易數量：300,000股\r\n每股平均價格：新台幣1,013.59元\r\n交易總金額：新台幣304,076仟元\r\n6.處分利益（或損失）（取得有價證券者不適用）:\r\n不適用\r\n7.與交易標的公司之關係:\r\n無\r\n8.迄目前為止，累積持有本交易證券（含本次交易）之數量、金額、持股\r\n比例及權利受限情形（如質押情形）:\r\n數量：241,000股\r\n金額：233,850仟元\r\n持股比例：0.009%\r\n9.迄目前為止，依「公開發行公司取得或處分資產處理準則」第三條所列之有價證券投\r\n資（含本次交易）占公司最近期財務報表中總資產及歸屬於母公司業主之權益之比例\r\n暨最近期財務報表中營運資金數額:\r\n占總資產比例:0.596%\r\n占母公司業主之權益比例:2.007%\r\n營運資金:新台幣12,513,762仟元\r\n10.取得或處分之具體目的:\r\n為提高本公司之資金運用效益\r\n11.本次交易表示異議董事之意見:\r\n不適用\r\n12.本次交易為關係人交易:\r\n否\r\n13.交易相對人及其與公司之關係:\r\n不適用\r\n14.監察人承認或審計委員會同意日期:\r\n不適用\r\n15.前已就同一件事件發布重大訊息日期: 不適用\r\n16.其他敘明事項:\r\n無""]], ""footer"": [""以上資料均由各公司依發言當時所屬市場別之規定申報後，由本系統對外公佈，資料如有虛偽不實，均由該公司負責。""], ""header"": {""note"": [], ""subTitle"": [], ""mainTitle"": [""公司當日重大訊息之詳細內容""]}, ""titles"": [{""main"": ""序號"", ""sub"": []}, {""main"": ""發言日期"", ""sub"": []}, {""main"": ""發言時間"", ""sub"": []}, {""main"": ""發言人"", ""sub"": []}, {""main"": ""發言人職稱"", ""sub"": []}, {""main"": ""發言人電話"", ""sub"": []}, {""main"": ""主旨"", ""sub"": []}, {""main"": ""符合條款"", ""sub"": []}, {""main"": ""事實發生日"", ""sub"": []}, {""main"": ""說明"", ""sub"": []}], ""companyAbbreviation"": ""皇翔""}, ""datetime"": ""115/01/15 15:24:05""}",2026-01-15 15:24:02
1150114|sii|2545|2,115/01/14,19:01:07,2545,皇翔,公告取得有價證券,有價證券,1150114,sii,2,"{""code"": 200, ""message"": ""查詢成功"", ""result"": {""marketName"": ""上市公司"", ""companyId"": ""2545"", ""data"": [[2, ""115/01/14"", ""19:01:07"", ""游玉華"", ""財務部副總"", ""23882898"", ""公告取得有價證券"", ""20"", ""115/01/14"", ""1.證券名稱:\r\n台灣積體電路製造股份有限公司\r\n2.交易日期:115/1/12~115/1/14\r\n3.董事會通過日期: 不適用\r\n4.其他核決日期:\r\n核決層級:董事長核決\r\n民國115年1月14日\r\n5.交易數量、每單位價格及交易總金額:\r\n交易數量：200,000股\r\n每股平均價格：新台幣1,697.92元\r\n交易總金額：新台幣339,585仟元\r\n6.處分利益（或損失）（取得有價證券者不適用）:\r\n不適用\r\n7.與交易標的公司之關係:\r\n無\r\n8.迄目前為止，累積持有本交易證券（含本次交易）之數量、金額、持股\r\n比例及權利受限情形（如質押情形）:\r\n數量：206,000股\r\n金額：348,109仟元\r\n持股比例：0.001%\r\n9.迄目前為止，依「公開發行公司取得或處分資產處理準則」第三條所列之有價證券投\r\n資（含本次交易）占公司最近期財務報表中總資產及歸屬於母公司業主之權益之比例\r\n暨最近期財務報表中營運資金數額:\r\n占總資產比例:0.665%\r\n占母公司業主之權益比例:2.242%\r\n營運資金:新台幣12,513,762仟元\r\n10.取得或處分之具體目的:\r\n為提高本公司之資金運用效益\r\n11.本次交易表示異議董事之意見:\r\n不適用\r\n12.本次交易為關係人交易:\r\n否\r\n13.交易相對人及其與公司之關係:\r\n不適用\r\n14.監察人承認或審計委員會同意日期:\r\n不適用\r\n15.前已就同一件事件發布重大訊息日期: 不適用\r\n16.其他敘明事項:\r\n無""]], ""footer"": [""以上資料均由各公司依發言當時所屬市場別之規定申報後，由本系統對外公佈，資料如有虛偽不實，均由該公司負責。""], ""header"": {""note"": [], ""subTitle"": [], ""mainTitle"": [""公司當日重大訊息之詳細內容""]}, ""titles"": [{""main"": ""序號"", ""sub"": []}, {""main"": ""發言日期"", ""sub"": []}, {""main"": ""發言時間"", ""sub"": []}, {""main"": ""發言人"", ""sub"": []}, {""main"": ""發言人職稱"", ""sub"": []}, {""main"": ""發言人電話"", ""sub"": []}, {""main"": ""主旨"", ""sub"": []}, {""main"": ""符合條款"", ""sub"": []}, {""main"": ""事實發生日"", ""sub"": []}, {""main"": ""說明"", ""sub"": []}], ""companyAbbreviation"": ""皇翔""}, ""datetime"": ""115/01/15 15:24:06""}",2026-01-15 15:24:02
1150115|sii|3708|1,115/01/15,08:55:05,3708,上緯投控,公告本公司董事會決議買回庫藏股,庫藏股,1150115,sii,1,"{""code"": 200, ""message"": ""查詢成功"", ""result"": {""marketName"": ""上市公司"", ""companyId"": ""3708"", ""data"": [[1, ""115/01/15"", ""08:55:05"", ""洪嘉敏"", ""協理"", ""049-2255420"", ""公告本公司董事會決議買回庫藏股"", ""35"", ""115/01/15"", ""1.董事會決議日期:115/01/15\r\n2.買回股份目的:維護公司信用及股東權益\r\n3.買回股份種類:普通股\r\n4.買回股份總金額上限(元):5,747,254,322\r\n5.預定買回之期間:115/01/16~115/03/15\r\n6.預定買回之數量(股):4,500,000\r\n7.買回區間價格(元):80.00~168.00，公司股價低於區間價格下限，將繼續買回\r\n8.買回方式:自集中交易市場買回\r\n9.預定買回股份占公司已發行股份總數之比率(%):4.18\r\n10.申報時已持有本公司股份之累積股數(股):6,000,000\r\n11.申報前三年內買回公司股份之情形:\r\n(1)實際買回股份期間：114/11/10 ~ 114/11/24 、預定買回股數(股)：3000000 、實際已買回\r\n股數(股)：3000000 、執行情形(實際已買回股數占預定買回股數%)：100.00\r\n(2)實際買回股份期間：114/09/30 ~ 114/10/27 、預定買回股數(股)：3000000 、實際已買回\r\n股數(股)：3000000 、執行情形(實際已買回股數占預定買回股數%)：100.00\r\n(3)實際買回股份期間：114/04/10 ~ 114/05/16 、預定買回股數(股)：3000000 、實際已買回\r\n股數(股)：2122000 、執行情形(實際已買回股數占預定買回股數%)：71.00\r\n(4)實際買回股份期間：113/08/12 ~ 113/09/30 、預定買回股數(股)：1500000 、實際已買回\r\n股數(股)：847000 、執行情形(實際已買回股數占預定買回股數%)：56.00\r\n12.已申報買回但未執行完畢之情形:\r\n不適用\r\n13.董事會決議買回股份之會議紀錄:\r\n案 由 二：本公司擬實施第九次買回庫藏股案。\r\n說    明：1、依「證券交易法」(以下簡稱證交法)第28條之2第1項暨「上市上櫃公司買回本公司\r\n股份辦法」買回本公司股份。\r\n2、買回股份目的：為維護公司信用及股東權益所必要而買回，並辦理銷除股份。\r\n3、買回股份種類：普通股。\r\n4、預定買回之期間：自申報之即日起算2個月內執行完畢，預計自115年1月16日起，至115年3月15\r\n日止。\r\n5、預定買回之數量(股)：4,500,000股。\r\n6、買回區間價格(元)：介於董事會決議前十個營業日或三十個營業日之平均收盤價（二者取高）之\r\n百分之一百五十與董事會決議當日收盤價(若董事會決議當時未有當日收盤價，應以前一個營業日收\r\n盤價)之百分之七十間為適，惟若當公司股價低於所定買回區間價格下限時，將繼續執行買回。\r\n7、買回方式:自集中交易市場買回。\r\n8、預定買回股份占公司已發行股份總數之比率(%)：4.18%。\r\n9、已持有本公司股份之股數(股)：6,000,000股。\r\n10、前次買回本公司股份執行情形：前六次買回全數轉讓完畢或註銷完成，第七次買回3,000,000\r\n股及第八次買回3,000,000股，合計6,000,000股待董事會決議減資基準日後辦理變更登記作業。\r\n11、本公司董事會已考慮公司財務狀況，上述股份之買回並不影響本公司資本之維持，並按上述內\r\n容出具董事會聲明書如附件二。\r\n12、以上說明，提請 討論。\r\n決    議：\r\n1.買回區間價格為新台幣80元到168元，買回股份總金額上限為新台幣756,000,000元。\r\n2.案經主席徵詢全體出席董事，均無異議照案通過。\r\n14.「上市上櫃公司買回本公司股份辦法」第十條規定之轉讓辦法:\r\n不適用\r\n15.「上市上櫃公司買回本公司股份辦法」第十一條規定之轉換或認股辦法:\r\n不適用\r\n16.董事會已考慮公司財務狀況，不影響公司資本維持之聲明:\r\n上緯國際投資控股股份有限公司\r\n董事會聲明書\r\n本公司經一一五年一月十五日第一次董事會三分之二以上董事之出席及出席董事超過二分之一之同意\r\n通過，自申報日起二個月內於集中交易市場﹙證券商營業處所﹚買回本公司股份4,500,000股。\r\n二、上述買回股份總數，僅占本公司已發行股份的百分之四點一八，且買回股份所需金額上限僅占本\r\n公司114年第三季合併財務報表流動資產的百分之五點二，茲聲明本公司董事會已考慮公司財務狀\r\n況，上述股份之買回並不影響本公司資本之維持。\r\n三、本聲明書業經本公司上述同次董事會議通過，出席董事7人同意本聲明書之內容，併此聲明。\r\n\r\n\r\n\r\n上緯國際投資控股股份有限公司\r\n負責人：蔡朝陽\r\n2026/01/15\r\n17.會計師或證券承銷商對買回股份價格之合理性評估意見:\r\n本案經證券承銷商凱基證券股份有限公司出具「買回公司股份價格合理性評估意見書」\r\n認為本次買回公司股份訂定之價格區間，其決策過程係具合法性，買回價格及對公司\r\n財務狀況之影響尚在合理範圍，並未發現重大異常情事。\r\n18.其他證期局所規定之事項:\r\n不適用""]], ""footer"": [""以上資料均由各公司依發言當時所屬市場別之規定申報後，由本系統對外公佈，資料如有虛偽不實，均由該公司負責。""], ""header"": {""note"": [], ""subTitle"": [], ""mainTitle"": [""公司當日重大訊息之詳細內容""]}, ""titles"": [{""main"": ""序號"", ""sub"": []}, {""main"": ""發言日期"", ""sub"": []}, {""main"": ""發言時間"", ""sub"": []}, {""main"": ""發言人"", ""sub"": []}, {""main"": ""發言人職稱"", ""sub"": []}, {""main"": ""發言人電話"", ""sub"": []}, {""main"": ""主旨"", ""sub"": []}, {""main"": ""符合條款"", ""sub"": []}, {""main"": ""事實發生日"", ""sub"": []}, {""main"": ""說明"", ""sub"": []}], ""companyAbbreviation"": ""上緯投控""}, ""datetime"": ""115/01/15 15:24:07""}",2026-01-15 15:24:02
1150114|sii|3708|1,115/01/15,08:57:59,3708,上緯投控,公告本公司董事會決議買回庫藏股註銷減資基準日,庫藏股,1150114,sii,1,"{""code"": 200, ""message"": ""查詢成功"", ""result"": {""marketName"": ""上市公司"", ""companyId"": ""3708"", ""data"": [[1, ""115/01/15"", ""08:57:59"", ""洪嘉敏"", ""協理"", ""049-2255420"", ""公告本公司董事會決議買回庫藏股註銷減資基準日"", ""11"", ""115/01/15"", ""1.董事會決議日期:115/01/15\n2.減資緣由:依證券交易法第二十八條之二規定，註銷本公司第七次及第八次庫藏股買\n回之股份。\n3.減資金額:60,000,000元\n4.消除股份:6,000,000股\n5.減資比率:5.57%\n6.減資後股本:1,017,518,650元\n7.預定股東會日期:不適用\n8.預計減資新股上市後之上市普通股股數:不適用\n9.預計減資新股上市後之上市普通股股數占已發行普通股比率\n（減資後上市普通股股數/減資後已發行普通股股數）:不適用\n10.前二項預計減資後上巿普通股股數未達6000萬股且未達25%者，\n請說明股權流通性偏低之因應措施:不適用\n11.減資基準日:115/01/19\n12.其他應敘明事項:無""]], ""footer"": [""以上資料均由各公司依發言當時所屬市場別之規定申報後，由本系統對外公佈，資料如有虛偽不實，均由該公司負責。""], ""header"": {""note"": [], ""subTitle"": [], ""mainTitle"": [""公司當日重大訊息之詳細內容""]}, ""titles"": [{""main"": ""序號"", ""sub"": []}, {""main"": ""發言日期"", ""sub"": []}, {""main"": ""發言時間"", ""sub"": []}, {""main"": ""發言人"", ""sub"": []}, {""main"": ""發言人職稱"", ""sub"": []}, {""main"": ""發言人電話"", ""sub"": []}, {""main"": ""主旨"", ""sub"": []}, {""main"": ""符合條款"", ""sub"": []}, {""main"": ""事實發生日"", ""sub"": []}, {""main"": ""說明"", ""sub"": []}], ""companyAbbreviation"": ""上緯投控""}, ""datetime"": ""115/01/15 15:24:07""}",2026-01-15 15:24:02
1150114|sii|3708|3,115/01/15,08:59:00,3708,上緯投控,公告本公司國內第三次有擔保轉換公司債及國內第四次無擔保轉換公司債轉換普通股之發行新股增資基準日,公司債,1150114,sii,3,"{""code"": 200, ""message"": ""查詢成功"", ""result"": {""marketName"": ""上市公司"", ""companyId"": ""3708"", ""data"": [[3, ""115/01/15"", ""08:59:00"", ""洪嘉敏"", ""協理"", ""049-2255420"", ""公告本公司國內第三次有擔保轉換公司債及國內第四次無擔保轉換\r\n公司債轉換普通股之發行新股增資基準日"", ""11"", ""115/01/15"", ""1.董事會決議日期:115/01/15\n2.增資資金來源:國內第三次有擔保轉換公司債及國內第四次無擔保轉換公司債\n3.是否採總括申報發行新股(是，請併敘明預定發行期間/否):否\n4.全案發行總金額及股數(如屬盈餘或公積轉增資，發行股數則不含配發給員工部分):\n發行總金額153,280元，發行股數15,328股\n5.採總括申報發行新股案件，本次發行金額及股數:不適用\n6.採總括申報發行新股案件，本次發行後，剩餘之金額及股數餘額:不適用\n7.每股面額:新台幣10元\n8.發行價格:不適用\n9.員工認購股數或配發金額:不適用\n10.公開銷售股數:不適用\n11.原股東認購或無償配發比例:不適用\n12.畸零股及逾期未認購股份之處理方式:不適用\n13.本次發行新股之權利義務:與原發行普通股股份相同\n14.本次增資資金用途:不適用\n15.其他應敘明事項:\n本次公司債轉換發行新股，增資基準日為民國115年01月20日，\n並依法令規定辦理變更登記事宜,本次增資後實收資本額為新台幣1,017,671,930元。""]], ""footer"": [""以上資料均由各公司依發言當時所屬市場別之規定申報後，由本系統對外公佈，資料如有虛偽不實，均由該公司負責。""], ""header"": {""note"": [], ""subTitle"": [], ""mainTitle"": [""公司當日重大訊息之詳細內容""]}, ""titles"": [{""main"": ""序號"", ""sub"": []}, {""main"": ""發言日期"", ""sub"": []}, {""main"": ""發言時間"", ""sub"": []}, {""main"": ""發言人"", ""sub"": []}, {""main"": ""發言人職稱"", ""sub"": []}, {""main"": ""發言人電話"", ""sub"": []}, {""main"": ""主旨"", ""sub"": []}, {""main"": ""符合條款"", ""sub"": []}, {""main"": ""事實發生日"", ""sub"": []}, {""main"": ""說明"", ""sub"": []}], ""companyAbbreviation"": ""上緯投控""}, ""datetime"": ""115/01/15 15:24:08""}",2026-01-15 15:24:02
1150115|sii|9955|1,115/01/15,15:14:12,9955,佳龍,因本公司有價證券於集中交易市場達公布注意交易資訊標準，故公布相關財務業務等重大訊息，以利投資人區別瞭解。,有價證券,1150115,sii,1,"{""code"": 200, ""message"": ""查詢成功"", ""result"": {""marketName"": ""上市公司"", ""companyId"": ""9955"", ""data"": [[1, ""115/01/15"", ""15:14:12"", ""陸怡豪"", ""策略顧問"", ""(03)473-6566"", ""因本公司有價證券於集中交易市場達公布注意交易資訊標準，故公\r\n布相關財務業務等重大訊息，以利投資人區別瞭解。"", ""51"", ""115/01/15"", ""1.事實發生日:115/01/15\n2.發生緣由:依臺灣證券交易所股份有限公司通知辦理\n3.財務業務資訊:\n                                                           單位:新臺幣佰萬元\n期間        最近一月   與去年同期   最近一季    與去年同期      最近四季累計\n--------- ------------ --------- -------------  ---------- ----------------\n           114年11月     增 減%    114年第3季      增 減%      113年第4季至\n                                                                 114年第3季\n科目      (個體自結數)        (IFRS-合併核閱數)            (IFRS-合併核閱數)\n--------- ------------ --------- -------------  ---------- ----------------\n營業收入        120      41.06%         382        32.14%          1,358\n稅前淨利         (7)     64.40%           4       116.48%           (124)\n本期淨利         (7)     64.40%           4       116.48%           (124)\n每股盈餘(元)  (0.06)     64.81%        0.04       119.05%          (1.19)\n4.有無「臺灣證券交易所股份有限公司對有價證券上市公司重大訊息之查證暨公開處理\n  程序」第4條所列重大訊息之情事（如「有」，請說明）:無\n5.有無「臺灣證券交易所股份有限公司對有價證券上市公司重大訊息之查證暨公開處理\n  程序」第11條所列重大訊息說明記者會之情事:無\n6.完整財務資訊請至公開資訊觀測站查閱，路徑如下：\n(1)近期營業收入及損益資訊：基本資料>精華版\n(2)歷史每月營業收入：營運概況>每月營收>採用IFRSs後之月營業收入資訊\n(3)歷史損益(會計師查核/核閱數)：財務報表>採IFRSs後>合併/個別報表>綜合損益表\n(4)歷史損益(自願性公告自結數)：營運概況>自結損益公告:\n7.其他應敘明事項:無""]], ""footer"": [""以上資料均由各公司依發言當時所屬市場別之規定申報後，由本系統對外公佈，資料如有虛偽不實，均由該公司負責。""], ""header"": {""note"": [], ""subTitle"": [], ""mainTitle"": [""公司當日重大訊息之詳細內容""]}, ""titles"": [{""main"": ""序號"", ""sub"": []}, {""main"": ""發言日期"", ""sub"": []}, {""main"": ""發言時間"", ""sub"": []}, {""main"": ""發言人"", ""sub"": []}, {""main"": ""發言人職稱"", ""sub"": []}, {""main"": ""發言人電話"", ""sub"": []}, {""main"": ""主旨"", ""sub"": []}, {""main"": ""符合條款"", ""sub"": []}, {""main"": ""事實發生日"", ""sub"": []}, {""main"": ""說明"", ""sub"": []}], ""companyAbbreviation"": ""佳龍""}, ""datetime"": ""115/01/15 15:24:08""}",2026-01-15 15:24:02
